2668,研报日期：2014-07-27上半年归属净利润同比增长38%，符合预期合兴包装发布中期业绩快报，预计上半年实现营收13.6 亿元，同比增长14.4%，归属净利润6528 万元，同比增长38.1%，EPS 0.19元，符合预期。销售收入增长及成本费用下降是公司业绩持续快速成长的原因，公司Q2 营收同比增17.6%，较Q1 有所加快，净利受去年Q2 因会计准则调整带来的高基数影响，增速34.7%。关注要点1. 公司盈利能力提升趋势延续，业绩进入收获期。2014 年上半年公司净利率进一步提升至4.8%，为近3 年来的最高水平，显示2013 年公司战略转型后，新基地产能利用率的提升以及内部整合管控的加强，驱动公司经营拐点确立，毛利率、净利率已从2013 年Q1 起呈稳步提升趋势（净利率有望从当前的4.8%逐步恢复至6%－8%的正常水平）。仅公司已有23 个生产基地满产后，净利润即有1.21-1.95 倍成长空间。我们认为未来2 年公司业绩将持续快速成长，维持公司14－15 年业绩复合增速39.2%的目标不变。2. 纸包装属于典型的大行业、小公司，电商经济兴起带来“二次包装”需求放量，驱动纸包装（尤其是瓦楞纸包装）行业高景气度。2013 年纸包装行业产值近5000 亿，成长快（06-13年产值CAGR 19%），竞争格局分散（4000 多家企业，TOP 10集中度不到10%，与欧美差距明显），近年来纸包装行业并购案例不断，行业集中度提升趋势明显，孕育巨头成长机遇，优秀包装企业有望胜出。3. 公司已成立并购基金来分享行业并购整合红利，助力自身更快成长，未来公司还有望围绕包装行业不断延伸产业链，巩固行业龙头地位。合兴包装具有全国布局、跨区域管控、优质客户资源、可复制生产模式等优势，未来将通过并购、延伸两种思路，不断扩大企业规模，提高服务附加值。估值与建议维持盈利预测。预计14－15 年EPS 0.38 元、0.53 元，若未来合兴包装对并购基金内的优质项目进行收购，则业绩存超预期可能。持续推荐。我们重申合兴包装是“纸箱经济”首选受益标的，其将受益纸包装的广阔整合空间，业绩层面新基地产能利用率提升与内部整合提效将驱动公司盈利能力提升趋势延续。并购基金的成立能提升市场对公司的未来前景预期，当前股价对应2014 年PE 24.8 倍，目标价13.3 元。风险新基地产能利用率提升缓慢，客户订单落实情况不及预期。[中国国际金融有限公司][点击查看PDF原文]提示：本文属于研究报告栏目，仅为机构或分析人士对一只股票的个人观点和看法，并非正式的新闻报道，本网不保证其真实性和客观性，一切有关该股的有效信息，以沪深交易所的公告为准，敬请投资者注意风险。,中期业绩同比增长38%，盈利能力持续提升，重申推荐查看PDF原文,研报,合兴包装,2
2669,准备拉升了,中粮生化开始快速上涨，你懂得也是食品也是做谷氨酸的,股东,梅花生物,1
2670,不知高低之人不可理他,当前主力意图比较明显啦,None,西泵股份,2
2671,老子不看不卖，气死你,老子不看不卖，气死你,股东,通产丽星,2
2672,这是傻逼行情啊！,是牛市初征么？傻逼行情么？解套就行了！阿弥陀佛！,股东,鼎泰新材,2
2673,蜗牛式爬升,蜗牛式爬升,None,广安爱众,1
2674,"阿里巴巴芝麻开们,哦也","今天洗的太漂亮了,早盘把大户洗出,拉高后把散户洗出,该古主力已绝对控盘,以后将随心所",None,奇正藏药,2
2675,银行股都在涨，鑫龙怎么不见涨？,鑫龙不是有大江银行吗？,None,鑫龙电器,2
2676,捞回亏损的方法：快速换股为300290、600571.相信我的推荐绝不会错,捞回亏损的方法：快速换股为300290、600571.相信我的推荐绝不会错,None,千方科技,0
2677,翻转时刻即将到来。还在一味做空，将踏空行情。主力之强大超乎你们的想象。如此高的净资产，如此高的公积金和相当不错的未分配利润。一送就变中盘股，赶上大潮流！静静等待主力的爆发！,力生制药，好股票。,None,力生制药,1
2678,"高抛，换000717韶钢股份，刚脱离底部涨幅不到10%，18跌到1.8准备撤退了，上证2160第一目标已经实现接下来要调整了，换小盘重组股云维股份，云南煤业入主承诺到期了四大凶股你有几？？601919从68到3.00000717从18到1.80600096从70到7.00000792从102到15.5A股氢燃料电池概念股：600096【增发】云天化｜增发年度 ｜增发方案 ｜｜2013-12-31 ｜进度说明:已实施 ｜｜ ｜发行方式:非公开增发 ｜｜ ｜实际增发数量:975034018 ｜｜ ｜增发价格:14.1元 ｜｜2011-12-31 ｜进度说明:已实施 ｜｜ ｜发行方式:非公开增发 ｜｜ ｜实际增发数量:103513229 ｜｜ ｜增发价格:17.93元 ｜氢燃料电池概念再添“新贵”证券时报记者从国家知识产权局了解到，云天化全资子公司云南云天化国际化工有限公司申报的“一种硫化氢及工业尾气制氢的方法”(专利号：CN201010155397.3)已由知识产权局授权。专利摘要显示，本发明首创性地提出磷肥与氮肥工业之间的硫、氢循环经济解决方案，也为氢能的生产提供了一种新的原料来源。市场人士分析，推广氢燃料汽车主要需要解决大量制取廉价氢气的方法，传统的电解方法价格昂贵，且耗费其他资源，无法推广。云天化此次制氢专利为氢能的生产提供了一种新的原料来源，云天化沾上氢气制备概念，有望得到资金热捧，对公司股价形成提振。值得提及的是，云天化国际是云天化2012年定向增发注入的优质资产，发行价格为14.30元/股，此批增发股将于今年5月解禁，与云天化现价倒挂明显。请问航运股和造船股应该哪个先复苏？A股远洋最高价69.00，最低2.80，现价3.45601919股价一向是600026的1.5倍，601919一向是HK01919的1.6倍601919业绩每股收益一向是601168西部矿业的4倍601919股价一向是601872招商轮船的4倍，601866中海集运的5倍601919业绩和股价一向是000898鞍钢股份的两倍远洋A股=H股*1.6港股远洋最低2.7，最高40.00.A股=H股*1.6601919=1919*1.6=4.02*1.6=6.4远洋股价相当于大盘上证指数280点。大盘最高6124点，1919最高68.00元601919合理股价=上证指数/100+10%合理股价排名第二熊股的鞍钢已经反转了，远洋还会远吗000898从35.00跌倒2.50，现在3.01元，业绩最好时每股收益1.00元/股601919从69.00跌倒2.70，现在2.75元，业绩最好时每股收益3.00元/股关于中国远洋 股价的理解【置顶】BDI指数与中国远洋A股H股价绝大多数时间内的粗略比价对应关系:BDI指数与中国远洋A股H股价绝大多数时间内的粗略比价对应关系:1100点:6.80元:4.00港元BDI指数与中国远洋A股H股价绝大多数时间内的粗略比价对应关系:2200点:13.60元:8.00港元BDI指数与中国远洋A股H股价绝大多数时间内的粗略比价对应关系:3300点:20.40元:12.00港元BDI指数与中国远洋A股H股价绝大多数时间内的粗略比价对应关系:4400点:27.20元:16.00港元BDI指数与中国远洋A股H股价绝大多数时间内的粗略比价对应关系:5500点:34.00元:20.00港元BDI指数与中国远洋A股H股价绝大多数时间内的粗略比价对应关系:6600点:40.80元:24.00港元BDI指数与中国远洋A股H股价绝大多数时间内的粗略比价对应关系:7700点:47.60元:28.00港元BDI指数与中国远洋A股H股价绝大多数时间内的粗略比价对应关系:8800点:54.40元:32.00港元BDI指数与中国远洋A股H股价绝大多数时间内的粗略比价对应关系:9900点:61.20元:36.00港元BDI指数与中国远洋A股H股价绝大多数时间内的粗略比价对应关系:11000点:68.00元:40.00港元（BDI的历史高点为2008年5月20日的11793点）07年10月远洋H股最高40.8港元,A股68.4元,BDI指数约11000点在过去4年的约1000个交易日内有900天基本如此,正负误差不过10％为啥68.4时应该卖出远洋;而6.84时应该卖入远洋.中国股市必须和投资思路反着做才能赚到真金白银！【中国远洋】68.4时业绩巨盈时就卖出它,,,,,赌,,,,,场内机构帐面获巨利后套现派发开溜6.84时业绩巨亏时就买进它,,,,,赌,,,,,场外机构趁机偷吸割肉筹码悄悄进场中国股市必须投机才能赚到真金白银！必须和投资思路反着做！！.............................................................................................................看到现价很多300系列公司就使我想起3年多前68.4元/股的中国远洋基因和潜质，要破财就把精力集中在现价中小市值股上吧！::创业板中小板股价（它门还刚刚从头部下来到脖子的位置,,离腰和大腿还远着呢）【要求不高】近三百家的创业板股票中至少要出现30家以上股价双对折的股票,才能谈其板块中期见底!创业板指1239点即使不是十年巨顶 ,也必是3&quot;5年的大顶;在中国这个投机泡沫市中,一但此板块指数现大顶,接下来不向下一半以上,咋么可能见大底呢??中国远洋601919半年报亏损该退市了中国远洋处于一个大级别行情的底部随着集装箱行业的复苏，干散货迟早也会复苏。海运业是经济周期的先行指标而且是最反映基本面情况的。远洋现在的形态类似于05年底的很多蓝筹股，业绩不差，但是就是不涨，而且成交量稀少，稍微来点量，就能造成影响。散户在这股上基本没有脾气，就是不断的被收割。现在可能在形成大头肩底的右肩部位，一旦再次突破年线，则确立趋势。今日的跳空，只要本周没有补，就更加确定未来趋势。大蓝筹的大型底部，不会是惊心动魄的拉涨，而只会犹犹豫豫，不知不觉中不断波段抬高底部，不会有涨停，甚至5％以上的都少见。但是你会发现，过了两个月，原来站在年线上了，再过两个月，你发现怎么就从底部上来一倍了。这就是大底部的情况，很多人涨起来，才知道，原来现在有行情了，而这时候，你也该被套了。超级中石油：中国远洋（601919）BDI狂升＋油价跳水＋严重低估＋央企重组=601919回到68.00从68.00元跌下来，最低8.00元，现在8.50.00元，真是垃圾！中国远洋（601919）竟然30.00元定向增发基金抢吼，奇怪！跑啊中国远洋处于一个大级别行情的底部， 随着集装箱行业的复苏，干散货迟早也会复苏。海运业是经济周期的先行指标而且是最反映基本面情况的。601919，600026业绩比中国船舶有优势航运恢复最好时601919可EPS达3.00元，600150可EPS达6.00元！600150现在股价是601919的7倍。西部矿业上天了中集集团当仙了就剩下601919中国远洋成精了601919，600026业绩比中国船舶有优势航运恢复最好时601919可EPS达3.00元，600150可EPS达6.00元！600150现在股价是601919的7倍。别听某些基金忽悠请问航运股和造船股应该哪个先复苏？两市跌得最狠的股票：601919绝对排第一！（新股小盘股ST风险太大）601919中国远洋最高68.00，现价7.98！超级中石油：中国远洋（601919）横了14个月该竖14个月了中国远洋（601919）从68.00元跌下来，最低8.00元，现在11.00元，市值比有些创业板还小，真是垃圾！中国远洋（601919）竟然30.00元定向增发基金抢吼，奇怪！跑啊回调即低吸股票底部在7块多，10年虽然只有0.60---0.70但股价已充分体现，公司未来盈利比较确定，2013年经济全面恢复业绩可达2.00元。11块里可以逐步建仓，一旦打开上升通道就耐心持有，获利会比西部矿业，中集集团，振华重工这几只股票大。601919高点比中石油高（68.00）！竟跑不赢中石油！看你横盘多久？（已经14个月了）601919是垃圾如何从68.00到10.00？跑不赢西部矿业、中国铝业，中国石油，你应该破腹谢罪1股000039=2.5股601919（601919横盘1年多）601919最高68.00000039最高点才36.00我鞍钢脱离底部，西矿还会远吗？可燃冰概念股600168从68跌到5.50！西部矿业(601168)可燃冰新材料发掘大有可为西部矿业（601168）：我国在青海省祁连山南缘永久冻土带成功钻获天然气水合物（可燃冰）实物样品，成为世界上第一次在中低纬度冻土区发现天然气水合物的国家。我国是世界上第三冻土大国，冻土区总面积达215万平方公里，具备良好的天然气水合物赋存条件和资源前景。据科学家粗略估算，远景资源量至少有350亿吨油当量。青海省政府与中国海洋石油总公司在2010年6月签署了《资源合作战略框架协议》。根据此协议，由青海省发改委牵头，中国海洋石油公司、青海省发展投资公司、青海西部矿业集团、中国煤炭地质总局青海煤炭地质局四家单位正积极联合成立可燃冰研究中心。可燃冰项目就是股份公司发现和开采的。到底谁是锂业巨头啊，资料供参考锂对国民经济和国家安全具有重要意义,是21世纪的能源金属。近10年,中国主要从国外进口碳酸锂产品。中国是一个多盐湖的国家,盐湖锂占锂资源工业总储量的85%。现代第四纪盐湖主要分布在我国西北的青海、西藏、新疆和内蒙古四省区,具有很好的开发前景。经过多年科研后,目前国内已经在西台吉乃尔和扎布耶两个盐湖建立了卤水提锂产业。本文对比研究了这两个盐湖资源状况和地理气候条件,以及由此而决定的盐湖资源开发工艺流程,探讨了其工艺优化方向。并指出这两个盐湖具有锂资源储量大,品位高的优势,但是受盐湖类型或地理气候条件限制,工艺上有待改善。建议继续加强对盐湖开发技术优化和对盐湖提锂产业的扶持。盐湖股份（000792） 察尔汗盐湖总面积为5856平方公里，是中国最大的可溶性钾镁盐矿床。湖中蕴藏着极为丰富的钾、钠、镁、硼、锂、溴等自然资源，总储量为600多亿吨，其中仅氯化钾表内储量为5.4亿吨，占全国已探明储量的97％；氯化镁储量为16.5亿吨，氯化锂储量800万吨。在200吨碳酸锂实验取得成功的基础上，集团与核工业北京冶金化工研究院合作，投资5.33亿元建设年产1万吨碳酸锂项目，组建了青海盐湖蓝科锂业股份有限公司。吸附法—卤水提锂技术是新工艺新技术，具有针对性和独特性，该技术达到了国际水平，锂回收率达到70％以上，产品纯度达到99％。2009年进入投料试车。在1万吨碳酸锂项目成功运行基础上，拟及时扩建适当规模的碳酸锂项目，并就氯化锂、钴酸锂、金属锂、锂电池等下游系列产品进行开发和研究，争取在较短时间内延伸锂产业链，并形成一定的经济规模。青海谋划打造中国锂都青海盐湖工业集团与广东佛山照明公司日前签署合作协议，双方将在盐湖资源的综合利用、电池级碳酸锂产品开发、市场销售及售后服务等方面展开全面合作，以打造“中国锂都”。青海省盐湖资源储量大，品位高，类型全，资源组合好，已初步探明氯化锂储量有２０１８万吨，储量居全国第一位，占全国已探明储量的９０％以上，占世界盐湖锂资源储量的１／３。近年来，随着锂电池的开发及新兴领域的发展以及高油价提升了新型动力汽车的迫切性和经济性，国际市场对碳酸锂需求量日益增长。据青海盐湖工业集团股份有限公司副总经理张生顺介绍，迅速增长的消费需求要求有与之相适应的产能，但我国目前采用的碳酸锂提取技术无法形成工业化大规模生产，而且由于纯度原因，目前自产的原材料只能供应一些对纯度要求不高的市场，限制了效益的增长。此次与佛山照明公司合作，意在共同开发青海的锂资源，提高锂资源的利用率。盐湖集团(000578)：察尔汗盐湖氯化钾表内储量为5.4亿吨，占全国已探明储量的97%；氯化镁储量为16.5亿吨，氯化锂储量800万吨；集团投资5.33亿元建设年产1万吨碳酸锂项目，锂回收率达到70%以上，产品纯度达到99%。锂业巨头000792盐湖股份国际钾肥涨价了000792盐湖股份记得氯化钾08年涨到5500元/吨，5年后每股收益可达到8元/股，合计15元股价市盈率才2倍KCL 5500元/吨 成本1500元/吨 每吨利润4000元/吨年销量300万吨左右年利润：300万吨*4000元/吨=1200000万元即120亿元每股收益：120亿元/16亿股本=8元/股市盈率：15元/8元=2倍柴达木盆地将成我国最大锂电池原料基地发布时间： 2009年05月19日 15:01 来源：中投顾问　 【字体：大 中 小】据中投顾问汽车行业分析师李胜茂指出，常规来说，新能源汽车产业链大致分3个环节：上有有色金属原材料，中有车载动力电池材料供应商和电池生产商，下有整车厂商。因有色金属资源具有极强的地域性，因此，在产业链上来看，新能源汽车产业的上有色金属企业将会非常集中。锂电产业属于新能源、新材料的新兴产业，世界各国都很重视，尤其是动力锂电池更备受关注。锂电上产业主要是天然矿产资源，包括钴、镍、锰、磷、铁、锂及各种化合物，其中尤以钴和锂用量最大，但它们在自然界中储量有限，属于稀缺资源。据中投顾问发布的《2008-2010年中国新能源汽车产业分析及投资咨询报告》指出，到2012年，国内有10％新生产的汽车是节能与新能源汽车，按届时汽车年产辆为1000万辆算，我国新能源汽车要达到年产100万辆的规模。中投顾问李胜茂指出，每辆新型动力汽车预计需要0.08吨左右的碳酸锂，一旦动力锂电池大规模应用在新能源汽车上，碳酸锂的市场潜力将十分巨大，预计到2012年仅新能源汽车对碳酸锂的需求每年就将达到5万吨以上。据中投顾问汽车行业分析师李胜茂介绍，在自主研发盐提锂、提镁技术及生产工艺的基础上，我国一些大型工业企业近几年来在柴达木盆地深处开始建设碳酸锂、氢氧化镁等化工产品生产基地。目前国内生产碳酸锂的企业主要集中在西藏矿业、中信国安、青海盐集团这三家公司，而这三家公司的镁、锂矿产均集中在柴达木盆地。资料显示，地处青海高原腹地的柴达木盆地富含有钾、钠、镁、锂、硼等矿产资源，其中氯化镁31亿吨，约占全国保有储量的99％;氯化锂近1400万吨，占全国保有储量的83％。中投顾问李胜茂预计柴达木盆地将成为我国最大的动力锂电池原料供应基地，未来我国车用锂电池碳酸锂原材料需求将得到有效地保障。为了综合利用盐镁、锂等资源，“十一五”期间盐工业集团公司将投资建成年产10万吨无水氯化镁、1万吨碳酸锂等项目，打造现代高科技盐化工基地。",高抛，换000717韶钢股份，刚脱离底部涨幅不到10%，18跌到1.8,None,章源钨业,0
2679,如果股价跌到4.50，就买入100万股先,如果股价跌到4.50，就买入100万股先,股东,曙光股份,2
2680,胎神。不懂你就不要乱开腔。此股票必会涨到38元。,胎神。不懂你就不要乱开腔。此股票必会涨到38元。,股东,*ST合泰,2
2681,有可能,st鲁北？,None,鲁北化工,2
2682,渤海活塞真大方，每10股送0.25元，（每股送2分5厘人民币）。当天每股即跌掉2毛五分，呵呵。那个独立董事蔡惟慈慢走，把圈了渤海活塞股东的钱吐出来再走！否则上帝饶不了你！你拿了我们的钱，会下地狱的！！！,渤海活塞真大方,None,渤海活塞,2
2683,,吴总睡觉都合不上嘴，一股6分钱分红就把大家打发了,None,日上集团,2
2684,卖了，你还敢去买啥，别以为自己聪明，装蛋,就让我喝点汤吧,股东,金正大,2
2685,亚宝你这么做，证监会不会查你吗？,亚宝你这么做，证监会不会查你吗？,None,亚宝药业,2
2686,全清仓！TMD！没成交量，没活性！,全清仓！TMD！没成交量，没活性！,None,中鼎股份,2
2687,看看大盘，亏死你猪,亚宝，你他娘的，猪操作,None,亚宝药业,2
2688,大资金进入，目标远大。,大资金进入，目标远大。,None,宏达新材,2
2689,大盘得了“麻疯病“,大盘得了“麻疯病“,None,美锦能源,2
2690,给我使劲涨！,给我使劲涨[拜神][拜神][拜神]！,None,宏达新材,1
2691,敢拿得出手让丰田世界车老大测试的续航400公里电池，丰田分别拿走两批次电池，会简单么？留给你们低买的时间可能很少，把握好啊，股友们。两桶油年赚走数千亿，（000511）球形石墨材料锂电池重量几十斤充电一次续航400公里（000511）球形石墨材料锂电池重量才几十斤，充电一次续航400公里，丰田公司已分别拿走了两批电池样板。比亚迪的充电一次续航200公里，而且电池重700斤。大家想想，这是一个世界级的中国石化和中国石油概念。。。。。就中国汽车两桶油年纯利润共数千亿元。。。。。。。。。。。。。这个什么级别的题材，，哪路资金不虎视耽耽？？？？？？？？？？？？？？？？？,敢拿得出手让丰田世界车老大测试的续航400公里电池，丰田分别拿走两批次电池,None,江淮汽车,2
2692,量能看下午，缩量获利走人。11.7以上持股,544,股东,中原环保,2
2693,千万别指望江淮上台面！,江淮就是一坨狗屎！,None,江淮汽车,0
2694,低估庄家要付出代价,大开杀戒,None,*ST天业,2
2695,上交所最新披露信息显示，现代制药(600420.SH)时任董事冯鸣，因在“窗口期”违规买卖自家股票，违反了交易所相关规定遭到通报批评处分。经上交所查明，上海现代制药股份有限公司于2014年3月28日披露2013年年度报告，时任董事冯鸣于2014年3月20日和3月27日累计买入现代制药股票62900股，并于2014年6月11日卖出现代制药股票13188股。上交所认为冯鸣未遵守《证券法》第47条以及《上市公司董事、监事和高级管理人员所持本公司股份及其变动管理规则》第11条、第12条和第13条的要求，在现代制药定期报告披露前和股票买卖6个月内禁止交易期间买卖现代制药股票，且未及时向现代制药报告。鉴于冯鸣的上述行为违反了交易所相关规定，上交所决定对现代制药董事冯鸣给予通报批评处分。DZH,现代制药董事违规交易股票 遭上交所通报批评,None,现代制药,2
2696,如题,老大，加多宝借壳的事怎么样了？,None,深深宝A,2
2697,如题,这个王八蛋庄家怎么狠劲砸盘呀？,None,冠农股份,2
2698,海亮总市值1000亿 现在金顶18亿 就是说开盘出来至少涨到300元！持有金顶的兄弟们拿住喽！,海亮集团整体上市！,None,四川金顶,2
2699,这是拿盐湖不当资源的节奏啊,这是拿盐湖不当资源的意思,None,冠农股份,2
2700,创板大涨可你怎么了,创板大涨可你怎么了,None,高新兴,0
2701,谢谢解放军给我赢利19万，今天全部卖出，西药再见了，今年不做了，休息。,谢谢解放军给我赢利19万，今天全部卖出，西药再见了，今年不做了，休息。,None,西藏药业,2
