1241,15与以下闭着眼睛毫不犹豫买进便宜筹码，机不可失，大幅补涨毫无疑问。,15与以下闭着眼睛毫不犹豫买进便宜筹码，机不可失，大幅补涨毫无疑问。,None,顺鑫农业,1,same
1253,今天大盘涨2%以上，交通银行已经封住涨停板，其它银行如果也涨停，今天全盘涨停,今天大盘涨2%以上，交通银行已经封住涨停板，其它银行如果也涨停，今天全盘涨停,None,史丹利,1,different
1284,w,今日盘面两点暗示 之后3天将完成重大突破,None,国电南自,1,different
1352,儿子发力,儿子发力,股东,当代东方,1,different
1372,即将启飞的龙……强烈买入,即将启飞的龙……强烈买入,股东,龙星化工,1,same
1386,调整也基本到位了。,几天来，单单投资长江证券和申银万国的收益就已经增加过亿了。,股东,锦江股份,2,different
1400,康美无敌了！,康美无敌了！,None,东诚药业,1,same
1403,"白云机场,理性判断","白云机场,理性判断",None,白云机场,2,different
1412,,风水轮流转，没涨的肯定会涨，耐心等待,None,秀强股份,1,different
1460,今天趋势，先抑后杨，由弱转强，突破年线压制......,600410中线看好短线有戏,None,华胜天成,1,different
1500,不涨都难。,长城电工本身就是高成长股，风电龙头，现在又是燃料电池龙头，你说涨不涨？,None,长城电工,1,same
1502,终于等到你差点要错过你 在最好的年纪遇到你 才算没有辜负自己 ，啦啦啦,终于等到你，哈利路亚,None,吉林森工,1,same
1513,这吧人气不够呀.没什么人发贴.我今天4.3又进了一些~,这吧人气不够呀.没什么人发贴.我今天4.3又进了一些~,股东,长春经开,1,different
1516,,宝钢股份：价值投资的典范，买入的人有福了！！！,None,宝钢股份,1,same
1535,根本不许看盘,国栋建设不断调低增发价的通不过的象征该股严重偏低随时飙升,股东,国栋建设,1,different
1584,耐心持有必赚大钱,九年大底，第三波主升浪开始了,None,波导股份,1,same
1629,开板是机会，可惜没钱。晚上卖756的，去了2114。看似危险的安全地。,开板是机会，可惜没钱。晚上卖756的，去了2114。看似危险的安全地。,None,登云股份,1,different
1632,空头请认清形势。,空头请认清形势。,None,洛阳钼业,0,different
1665,现在做空的，请认清形势，风险有多大，知道吗？,现在做空的，请认清形势，风险有多大，知道吗？,None,开滦股份,1,different
1706,吃的放心。用的放心。买了也放心,很稳，很放心。短期目标8块冇问题,股东,易食股份,1,different
1738,历史告诉我们，上海本地股从不缺席每次大涨！,快抢筹！上海本地股随时整体脉冲式拉升！,股东,上海梅林,1,different
1744,安心等待   主战场还是股指期货    这波大主力就是要拉升诛空军心,第一波 权重 拉指数,股东,海峡股份,1,different
1756,托儿们在片筹码，大家小心，满仓不动，18元以上，事实说话,托儿们在片筹码，大家小心，满仓不动，18元以上，事实说话,None,升华拜克,1,different
1799,兄弟，看到了吧，4.4元分分钟就突破了，等着拉升吧，不过要注意主力增仓，谨防主力拉高出逃，如果主力不逃，就有好戏了,终于突破4.40元了,None,宝钢股份,1,different
1803,053不管是银行，还是稀土借壳都是中小盘.潜力都很大！,053不管是银行，还是稀土借壳都是中小盘.潜力都很大！,None,中江地产,1,different
1852,耐心加等待,高歌启航，启动出行,None,友好集团,1,different
1857,"大盘今天可能大涨70点以上,各类股全面大涨","大盘今天可能大涨70点以上,各类股全面大涨",股东,新城B股,1,same
1893,都满意了吧，要知道即使进退哦,前天介入的都笑了吧,None,银河磁体,1,different
1930,"请看上周5,25号,他的博客,列举了22只股,就有鲁北化工.",带头大哥777说类似鲁北化工股中至少3只翻倍,None,鲁北化工,1,different
1940,2100点的多单保本止损,2135的多单， 现价2175平仓，2100点的5000手多继续持有,None,江苏索普,1,different
2038,没银行的赶快配置一点 以后银行涨不起  中国股市也完蛋  我剁手,以后是主板天下  银行为王,股东,山东药玻,1,different
2052,大家放心买入,第一大铅锌矿，超级便宜上60元,股东,宏达股份,1,same
2062,下午两点拉七个点以上,下午两点拉七个点以上,None,中珠控股,1,same
2083,我看好你噢  粮食安全  月月讲  年年讲  中粮威武   南疆  像东北一样的天下粮仓  稳固后方利器,中粮  看好你噢,None,中粮屯河,1,same
2089,又有不少人，26元以下买入的机会不是很多了，讯飞的时间节点,谁在贪婪的等待犹豫中失去机会,股东,科大讯飞,1,same
2096,哈哈哈哈,国元证券，我来了哈,None,国元证券,1,same
2128,长期持有！！！,牛市赚钱秘诀，买入南高，长期持有！！！,None,南京高科,1,same
2141,心态,无量待涨等待出行,None,友好集团,1,different
2144,十年如一坚持投资原则！,十年如一坚持投资原则！,股东,动力源,2,different
2146,静等创新高。22.5指日可待,静等创新高,股东,中青旅,1,same
2174,上周出完   后悔啊,上周出完   后悔啊[好逊],None,凌云B股,1,same
2185,静待精诚铜业破十！,静待精诚铜业破十！,None,精诚铜业,1,same
2208,600477可以少量进些！,600477可以少量进些！,股东,当代东方,1,same
2209,赶紧进入有色最低价股 中国铝业 下一战妖铝,赶紧进入有色最低价股 中国铝业 下一战妖铝,None,建设机械,1,same
2228,拭目以待！,今天（7月28日）600380收盘不涨8个点以上，我就吃下一万斤屎，拭目以待！,None,健康元,1,same
2243,此股不涨，天理难容,果断杀入首旅,股东,首旅酒店,1,same
2253,大黑马，必爆涨，安心持股,大黑马，必爆涨，安心持股,None,长城电工,1,same
2270,最后买入的机会,最后买入的机会,股东,禾欣股份,1,same
2302,从此向上不回头,从此向上不回头,股东,永安药业,1,same
2318,会大涨！！！买入！,好股，买！,股东,巨星科技,1,same
2338,下一战四大银行 ，中字头低价股革命！！！,下一战四大银行 ，中字头低价股革命！！！,None,建设机械,1,same
2339,半年报会有惊喜,半年报会有惊喜,股东,曙光股份,1,same
2392,快买即将连续涨停板股票600636.600546！,快买即将连续涨停板股票600636.600546！,None,江淮汽车,1,same
﻿4201,大盘狂涨100多点，死地不动，气恨交加呀！大盘眼看短期到顶，死地可别跟随暴跌呀，担惊受怕！,拿着金地的散户是不是气恨交加又担惊受怕？,股东,金地集团,0,same
4222,半仓不管你折腾,没有大单。不加仓,None,上海电力,0,same
4224,如题。呵呵,在3.38和3.41挂万手买单的骗子哪去了？,None,万通地产,2,different
4226,你到底属于主板，还是题材。。难道你只会跌????,你到底属于主板，还是题材。。难道你只会跌????,股东,同仁堂,0,same
4238,都快死了！,不要插老傅了，老傅前后都烂了,None,金鹰股份,0,different
4242,没实力完意,换股了，真墨迹。垃圾,None,金鹰股份,0,same
4262,（1）现场会议召开时间：2014年8月11日（周一）14：30（2）网络投票时间：2014年8月11日9:30—11:30，13:00—15:00股东们都来投反对票！！！！,董事会对股民不负责，坚决反对他们的所有提议！,None,武汉控股,2,different
4272,几个万手的托单 推着股价涨了几分钱 然后撤单跑了 主力资金流出的 这也太假了,几个万手的托单 推着股价涨了几分钱 然后撤单跑了 主力资金流出的 这也太假了,None,长春燃气,0,different
4275,小散太多了烂,小散太多了烂,None,道博股份,0,same
4276,国资委的垃圾股赶快卖,长春经开 会不会最近设立民营银行，敬请期待中,None,长春经开,0,same
4299,今天要套一大批，上当了。,今天要套一大批，上当了。,None,奇正藏药,0,same
4318,垃圾股谁还买，看不到买卖盘情况么？一周大盘大涨，这垃圾扫一边，进垃圾池了，谁买谁倒霉！,垃圾股谁还买，看不到买卖盘情况么？一周大盘大涨，这垃圾扫一边，进垃圾池了，谁买谁,None,维科精华,0,same
4321,快离场吧 别犹豫了,快离场吧 别犹豫了,None,洛阳钼业,0,same
4361,不在关注此股，有缘再见吧！,不在关注此股，有缘再见吧！,股东,徐家汇,0,same
4362,大盘节奏踏得真准，不仅准，而且狠，不知道砸那么深丢的筹码打算如何捡回？凡事不可太过～,空军砸得真是时候,股东,中环股份,0,different
4373,,绝世奇葩啊，把老王的脸都丢尽了,None,威远生化,0,different
4404,有没有时间表？,这个垃圾啥时候股改？,None,S佳通,0,different
4438,恭喜山钢，今天收盘将抢到倒数第一的宝座，马钢晋级了。,恭喜山钢，今天收盘将抢到倒数第一的宝座，马钢晋级了。,None,山东钢铁,0,different
4449,跟风诱多而已，卖出不会悔,跟风诱多而已，卖出不会悔,None,蒙草抗旱,0,same
4488,1,卖掉了，还留1手。换劵商股了。002208是垃圾,股东,合肥城建,0,same
4497,还在不停地卖股？葬你家全族是吧！,申猴子家一户口本要多少钱来葬啊？,股东,海兰信,0,different
4505,太TMD的二百五了。。。,太TMD的二百五了。。。[卖出][卖出][卖出],None,银轮股份,0,same
4525,大盘都涨成那样了千金还不动真是垃圾,垃圾,None,千金药业,0,same
4543,还可以跑,这鸟股没毛，飞不起来!,None,鲁西化工,0,same
4551,思想落后，榆木脑袋不开窍。,东北，振兴不起来。2501，涨不起来。,None,利源精制,0,same
4568,崩盘了,吃屎控股马上跌停,None,七喜控股,0,same
4587,万紫千红一点绿,这地方还真环保,None,一汽富维,0,different
4591,就这价了  涨不了啊。,就这价了  涨不了啊。,None,襄阳轴承,0,same
4602,烂到家了。大盘都这样了，压个屁呀。,你马，庄家真烂,股东,金正大,0,different
4610,持有九鼎新材的散户终于明白什么是傻吊了！就是你自己！,持有九鼎新材的散户终于明白什么是傻吊了！,股东,九鼎新材,0,different
4612,主力已跑路   散户亏掉裤          九鼎新材现在就是这样子,主力已跑路   散户亏掉裤          九鼎新材现在就是这样子,股东,九鼎新材,0,same
4689,如题,垃圾,None,厦门钨业,0,same
4708,垃圾中的战斗机,垃圾中的战斗机,None,厦门空港,0,same
4724,重组成这样，苦等8年,套在9.58的朋友被21世纪害了，明天统一行动投反对票,None,红阳能源,0,different
4731,巢东主力无力呀？,巢东主力无力呀？,股东,巢东股份,2,different
4732,疯狂拉抬在指数掩护下     小庄轻轻地走了，,最后的疯狂,None,露天煤业,0,same
4757,5.19全部出货。,5.19全部出货。,股东,铁龙物流,0,different
4796,不会再开了,不会再开了,股东,抚顺特钢,0,same
3003,看好煤炭股，我已卖了首创股份，买入煤炭股,煤炭短缺，水资源丰富,股东,首创股份,0,different
3012,他妈的啥时候不停大盘好转了停了 婊子东西,他妈的啥时候不停大盘好转了停了 婊子东西,股东,合众思壮,0,same
3020,海立信：这股均线之下不要进，太差劲，一点动力没有，这股肾亏太重。,海立信：这股均线之下不要进，太差劲，一点动力没有，这股肾亏太重。,股东,海兰信,0,same
3044,通宝放量不涨！危险期，前期的缺口补掉了，80%会向下走，待时间验证个人关点，不喜勿喷,大盘今天巨量，天量天价！通宝放量不涨！危险期，前期的缺口补掉了,None,通宝能源,0,same
3045,不等了，殺入山煤國際！！,不等了，殺入山煤國際！！,股东,乐凯胶片,0,same
3062,股价很难突破5元价位，步入下跌,股价很难突破5元价位，步入下跌,股东,曙光股份,0,same
3098,亚宝这是在卖淫啊？大盘红通通一片，她躲在暗处，在搞什么名堂啊,亚宝这是在卖淫啊？大盘红通通一片，她躲在暗处，在搞什么名堂啊[为什么],None,亚宝药业,0,same
3099,指数涨没人买长青。垃圾股鉴定完毕。买了常绿。,指数涨没人买长青。垃圾股鉴定完毕。买了常绿。,None,长青股份,0,same
3176,,看还要跌哦，还要退市呢。,None,韶钢松山,0,same
3190,出货,中粮屯河一一一一一一不用质疑它确实在出货,None,中粮屯河,0,same
3208,打死都不要买国元这个垃圾股,打死都不要买国元这个垃圾股,股东,国元证券,0,same
3218,2市第一垃圾股，绝对是第一没有之一！！！！！,2市第一垃圾股，绝对是第一没有之一,None,青岛碱业,0,same
3231,/,大盘 到  顶 600568下午绿 盘 的 干 活 ///,股东,中珠控股,0,same
3232,生益懂事们阳委了,生益你争争气呀！,股东,生益科技,0,same
3249,大家逢高清仓，把弱B小嫩庄套在高位,千万别追高，737收盘惯性早泄不收绿是万幸了,None,中粮屯河,0,same
3268,就是垃圾,就是垃圾,股东,国中水务,0,same
3272,垃圾,跑不赢大盘,None,三元股份,0,same
3281,主力准备实施的下一步阴谋——那就是短线要进入调整洗盘。洗出不坚定筹码。短线的朋友要小心了！但些股整体趋势是不错的。可等调整下来后继续介入把握下一波机会。,还有多少赚钱的机会？,None,鑫富药业,1,different
3310,生益懂事会的人有精神病了,生益今天不正常,股东,生益科技,0,different
3329,股市淘金者中国梦之流，就是垃圾,股吧来了不少托，坚决卖出,None,振华科技,0,same
3332,不好意思，心里承受不了，7.7全部清场,不好意思，心里承受不了，7.7全部清场,None,洛阳钼业,0,same
3334,浮肿是病入膏肓的前兆！,浮肿！,股东,锦龙股份,0,same
3361,,快换股，翻翻行情已经展开，日上完蛋了,None,日上集团,0,same
3390,,出货进行时，欢迎大家接筹码,None,日上集团,1,different
3396,这烂股在争取时间,人挪活，树挪死，还在犹豫什么，等大盘会跳，这烂股一马当先，哭死你们,None,亚通股份,0,same
3428,下午大跌,下午大跌,股东,华泽钴镍,0,same
3436,/,全  是    散      户  快跑///,股东,中珠控股,0,same
3445,大股东不玩这个公司，大家都撤了吧,3兄弟合伙造假收购，大肆卖空股票,None,天龙集团,0,same
3481,垃圾 小单买大单卖 想散户接货,垃圾 小单买大单卖 想散户接货,None,宜科科技,0,same
3484,股价应该还有下探空间,股价应该还有下探空间,股东,曙光股份,0,same
3537,五个字，股民很受伤！,300323中止重组，今天开船跌停,None,众信旅游,0,same
3570,大跌,周线变盘,None,平高电气,0,same
2407,新城的操盘手果然是技术型人才。,新城的操盘手果然是技术型人才。,None,新城B股,2,different
2414,/,没有人 喊多了 被主力砸掺了 ///,股东,中珠控股,0,same
2425,今天涨停,今天涨停,股东,登云股份,2,different
2439,最新消息八月初ST合泰又將停牌,最新消息八月初ST合泰又將停牌,None,*ST合泰,0,same
2443,又错过行情了。三元注定是只倒煤的票。,要是上证跌1.5个点，这SB还不得跌停？,None,三元股份,0,different
2462,死股一只,死股一只,None,亚通股份,0,different
2487,买点有色去了，这B太浪费时间,走了,None,曙光股份,0,same
2533,买入阳泉煤业,什么破股啊 害我错过一轮行情,None,宜安科技,0,different
2534,大盘暴涨它不涨，此中必有隐情，会隐藏什么样的大利空呢？散户要慎重思考咯！小心下午暴跌？,广州发展下午真的要暴跌吗？散户逃命？,None,广州发展,0,different
2547,想赚快钱的赶紧换股，投资的赶紧关机，不换股不关机，少活10年能怨谁。,想赚快钱的赶紧换股，投资的赶紧关机，不换股不关机，少活10年能怨谁。,股东,中兴商业,0,different
2558,在低位，且5个交易日内跑输大盘的股不足百只，而铁龙名列前茅，够狠，我服了，真服了,买了这只王八，我都不好意思跟别人说我炒股了,None,铁龙物流,0,different
2567,垃圾股换股浪费了好时机。走了！等我赚够了再来!,垃圾股换股浪费了好时机。走了！等我赚够了再来!,None,长青股份,0,same
2621,庄家又在对倒，股价并没有上升，这个狗庄太垃圾，想出票，应拉高。,庄家又在对倒，股价并没有上升，这个狗庄太垃圾，想出票，应拉高。,None,理工监测,0,different
2632,,出了如释重负,None,啤酒花,0,same
2634,买进刚开始启动还未大涨的股，000677恒天海龙！补涨随时开始！,已升至浪顶，不追高！或抛出换股！,None,宝钢股份,0,same
2640,冒回傻气,4.66元买入的，只求解套，不求获利,None,紫江企业,1,different
2643,别人在赚钱，我的却在等解套，痛苦啊，2.80元的成本,别人在赚钱，我的却在等解套，痛苦啊，2.80元的成本,None,南方航空,2,different
2651,即使8元买了也舒服，跌吧。我拿着了,继续跌，在买点，手里没皇台睡不着觉,None,皇台酒业,1,different
2693,千万别指望江淮上台面！,江淮就是一坨狗屎！,None,江淮汽车,0,same
2704,医药生物指数（000808）已经涨到年限6407点，基本面很好的智飞生物为何离年线（25.48）还有13%的差距！智飞超跌，还在坑底！不买更待何时？,医药生物指数大涨，为何智飞不涨？！,None,智飞生物,1,different
2708,垃圾股。,垃圾股。,None,长青股份,0,same
2710,大家都涨疯了。你丫的傻比，我都不知道说你什么好。气的我快吐血了。,王八蛋就是王八蛋,股东,万邦达,0,different
2733,迅速逃顶。。。只跟跌不跟涨 不会有机会翻身 即将跌破翻绿,迅速逃顶。。。只跟跌不跟涨 不会有机会翻身,None,标准股份,0,same
2742,跌！还要跌！,跌！还要跌！,None,宝馨科技,0,same
2782,555,被套此股中悲哀呀,股东,千方科技,0,different
2831,如题,上周五买得好爽，这周突破上去，涨停,None,华芳纺织,1,different
2840,。。,在出货，快闪,None,益生股份,0,same
2853,抗跌更抗涨的垃圾股，拜拜吧！,抗跌更抗涨的垃圾股，拜拜吧！,股东,国栋建设,0,same
2861,坚决卖，下午大跌！！！,出货行情，一个字——卖！,None,中国国贸,0,same
2904,走为上,割肉走了，大盘疯涨，这货疯跌，走为上,None,中房地产,0,same
2950,看看最近大盘的表现，再看看000156，再想想最近的政策出台，华数非常的不妙啊。,000156必大跌啊,None,华数传媒,0,same
2962,咱们都是牛人，大盘暴涨，咱们的票居然是绿的，囧囧囧囧,咱们都是牛人，大盘暴涨，咱们的票居然是绿的，囧囧囧囧,股东,常林股份,0,different
2967,此波跌至10元，本人已经清仓完毕。,佳通狗庄资金正在撤离战场,股东,S佳通,0,same
2973,该发力时就得发力，没气魄,458主力有点焉,None,时代新材,0,different
2982,大单吃完庄家就要洗盘了  大盘大涨 庄家怎么可能把那么低的筹码给大家 反正我是走了  下午跟明天绝对大跌,大单被吃完就要大跌了,None,顺网科技,0,same
3610,,有资金在大肆出逃延长化建,None,延长化建,0,same
3618,今天的走势果不出我所料，下午再盘下去吧,庄家快看,None,科达股份,0,same
3624,tnnd，是不是有何利空，深圳指数大涨，他还在托后腿啊,tnnd，是不是有何利空，深圳指数大涨，他还在托后腿啊,股东,天马精化,0,same
3644,呵呵,散户们，千万不要接货，这垃圾题材 业绩什么都没，怎炒？,股东,维科精华,0,same
3672,"300130，不多说了 ，创业板暴跌,泥沙俱下，重组、业绩自己看，题材、概念自己找","权重股到头了，曝光翻倍黑马,底部横盘1年多 股东人数减少38%",None,古越龙山,0,same
3679,如题,今天高位放量滞涨，庄家在利用大盘好出货！,None,北京城建,0,same
3685,董事长：增发价37元多，现价只有27元多，做企业诚信为上,董事长：增发价37元多，现价只有27元多，做企业诚信为上,None,万邦达,2,different
3754,大盘狂涨，这垃圾不动还下跌，主力缺爹了，老子闪了1000股，赚了老子200块给你女马擦比去,002036真垃圾啊，闪人,None,宜科科技,0,same
3807,000778新兴铸管仅供参考，自己看资料，必须翻倍，立帖为证,浅套的，下午换股，再不换就没机会了,None,日上集团,0,same
3831,哈哈,7.65又加仓5000，成本是越来越高,股东,蓝鼎控股,1,different
3839,可恶的300341每次大盘大涨就停盘，亏透了！,可恶的300341每次大盘大涨就停盘，亏透了！,None,麦迪电气,0,same
3884,庄家的妈妈爸爸2014年7月28日死了,庄家的妈妈爸爸2014年7月28日死了,None,美罗药业,2,different
3897,我换银行股了美罗药业你去死吧,我换银行股了美罗药业你去死吧,None,美罗药业,0,same
3905,狗日的，大盘都漲了45点了，你妈妈还不动，畜牲！,狗日的，大盘都漲了45点了，你妈妈还不动，畜牲！,None,均胜电子,0,same
3908,怎么都想骂你，中兴，你不涨中国怎么兴，就挺起身杆涨起来。别老不要脸了,不要脸,None,中兴商业,0,different
3911,要是能的话，主力就不拉多好,谁踏空了？用脑子想想，还能捡到便宜吗？,None,长安汽车,2,different
3912,前期涨得太【多】所以现在补跌，哈哈,前期涨得太【多】所以现在补跌，哈哈,None,华北高速,0,same
3935,这个死股，拿了三个月，小赚点刚才三元卖了，再也不买这种不死不活的孬股票了,这个死股，拿了三个月，小赚点刚才三元卖了，再也不买这种不死不活的孬股票了,None,山东高速,0,same
3944,金益已经增仓完毕，在中报出来之前力生只有拉升一件事情了,业绩下降是力生终于高送转的原因,股东,力生制药,1,different
3949,要不是大盘好,中牧跌停了,None,中牧股份,0,same
3984,再这样下去一定有人举报，豆豆看,小心证监会查你老鼠仓,None,太化股份,2,different
3991,小心,大盘放量滞涨，出现头部迹象,None,武汉控股,0,same
3997,这个股没大庄，只有几个折腾的大户。10--11元会折腾好久。中报和第三季度报业绩都是很差。,10个点利润坚决跑，10元买，11元卖,None,联美控股,0,same
3998,各种资源都在涨，国新算什么？,各种资源都在涨，国新算什么？,股东,国新能源,2,different
4012,本次洗盘很彻底。走着瞧吧,本次洗盘很彻底。走着瞧吧,股东,兰生股份,0,same
4021,坚决卖出，它nnd。卖出。,坚决卖出，它nnd。卖出。,股东,动力源,0,same
4029,浪费老子时间,这庄好弱啊，看他拉我都费劲,None,动力源,0,same
4050,黑庄，鉴定完毕,黑庄，鉴定完毕,None,山东药玻,0,different
4095,铜峰电子高管：臭不要脸！,铜峰电子高管：臭不要脸！,None,铜峰电子,0,different
4113,你们不崩溃，调整不结束，目标8.5！,既然是调整，必须让你们崩溃！,None,合兴包装,0,same
4120,"清仓吧兄弟们,大盘这么涨守着林小姐这只烂股不划算呀你们是什么建议?","清仓吧兄弟们,大盘这么涨守着林小姐这只烂股不划算呀你们是什么建议?",None,中房股份,0,same
4147,今天不是大盘暴涨，这个股会跌停板,今天不是大盘暴涨，这个股会跌停板,None,天顺风能,0,same
4151,让庄家慢慢玩去,上27走人，此庄如龟庄。,股东,远方光电,0,different
4182,嘛的，压盘太明显了,压你嘛了个逼,None,明星电力,0,different
4828,水货,高台跳水的前兆！赶紧逃。。。,股东,动力源,0,same
4835,跑啦别错过这么大的行情赚钱机会啊,跑了，这行情换什么股都赚比这多,None,龙源技术,0,same
4843,哈哈,垃圾就是垃圾斩仓换股是明智选择,股东,黑化股份,0,same
4847,为什么？求解,大盘走的很好　　这股为什么不涨　反而跌呢,None,美亚光电,0,different
4906,没救了，走了！,没救了，走了！,None,新五丰,0,same
4958,善良的小散户撤吧 弄不好又让人家庄给涮了,善良的小散户撤吧 弄不好又让人家庄给涮了,None,洛阳钼业,0,same
4989,所以002231不活跃，也不可能活跃！,只能说大股东一无背景！二无能力！,None,奥维通信,0,different
24,.,"机构已经出货,600210讲故事行情结束了",None,紫江企业,0,same
26,紫江（600210）已十分危险，宜适时遛吧,紫江（600210）已十分危险，宜适时遛吧,None,紫江企业,0,same
28,笑死我了唱多的都是弱智，反正老子明天割肉！！！,笑死我了唱多的都是弱智，反正老子明天割肉！！！,股东,乐凯胶片,0,same
29,明天最好调整下，打新资金就挪出来了!看庄有没这胆量!,明天最好调整下，打新资金就挪出来了!看庄有没这胆量!,None,首钢股份,0,same
34,尾盘急拉，非奸即盗，明天必跌，幸好清仓了,尾盘急拉，必跌,None,均胜电子,0,same
