635,同花顺Ｆ１０个股信息雷显示：大立科技（002214）半年报净利润同比增长98%，公司预计1至9月净利同比增长50%至80%，主要系红外热像仪业务稳定增长。,重大公告利好消息,None,大立科技,1,same
641,登海的目标就是跑赢活期利息，走势很稳健，我是国际章,恭喜登海种业的股友，又错过了这波行情,None,登海种业,1,same
642,今天收盘又是5块左右，又是穿鞋戴帽的k线图,今天收盘又是5块左右，又是穿鞋戴帽的k线图,股东,金鹰股份,2,different
653,大盘这么好，你为什么狂出货,为什么狂出货？,股东,方正电机,1,different
692,牛中牛，真牛，全仓18元以上,牛中牛，真牛，全仓18元以上,None,升华拜克,1,same
731,滚滚向前的历史车轮正在把那些保守踏空者碾得粉碎。,两岸猿声啼不住，轻舟已过万重山。。。,None,龙星化工,0,different
739,大盘居然高开这么多，我看有意思，不知道要怎么把散户弄死,大盘居然高开这么多，我看有意思，不知道要怎么把散户弄死,None,贵研铂业,2,different
740,和哈哈哈哈哈哈哈哈哈哈哈哈和,必大涨我已买入3W股+了刚成交的,,全柴动力,1,same
757,不到10元不买,向上,None,洛阳钼业,1,same
768,资金翻红了，,国电 资金翻红了，反转成功，要上攻大涨了,股东,国电南自,1,same
777,明晚10送转10信息泄露，大户和机构即将争先恐后抢筹导致迅速涨停板，拭目以待。,明晚10送转10信息泄露，大户和机构即将争先恐后抢筹导致迅速涨停板，拭目以待。,None,顺鑫农业,1,same
798,加！,大胆加仓！,None,康盛股份,1,same
800,一盘乱麻的荃银高科，中植系进驻成功，成为大股东之一，连飘两个涨停。康盛7.21中植进驻已成定局，到目前还在底部调整，前期顶是阻力位吗？大家拭目以待吧,中植进驻荃银高科，连两停！康盛会如何？,None,康盛股份,1,different
812,中国股民要发财立即买600325 题材丰富又破净!买华发股份无错,中国股民要发财立即买600325 题材丰富又破净!买华发股份无错,None,华东医药,1,same
814,哈哈,欢迎巨人网络，分众传媒，盛大游戏来借壳,None,*ST霞客,2,different
825,资金翻红,资金翻红了，反转成功，要上攻大涨了,股东,广晟有色,1,same
920,,江淮汽车 马上调整完毕， 3信号决定飙升暴涨来,None,江淮汽车,1,same
930,不信的可百度，怪不得上周大盘连续上涨,10万亿资金将进入股市，牛市行情将来临,None,三力士,1,same
933,震撼异常。。。。。,10个涨停够不够？！？,None,西藏天路,1,same
946,今天晚上公布……想发财的请进……,今天晚上公布……想发财的请进……,None,鲁北化工,2,different
967,今天想不涨都难,今天想不涨都难,股东,动力源,1,same
969,什么玩意,谁卖我们就草他吗,股东,维科精华,1,same
971,81领唱航空与环太军事。。。。。。,81领唱航空与环太军事。。。,None,哈飞股份,1,different
989,进入,主力甚不甘心 今日必定大涨,None,国电南自,1,same
995,呵呵,哪个2b在卖，太有才了,股东,海泰发展,1,same
1016,什么都不缺了，等风来吧,什么都不缺了，等风来吧,股东,天通股份,1,same
1024,今天如果中阳，我就重仓为主力加油,今天如果中阳，我就重仓为主力加油,None,全柴动力,1,different
1038,华发转型后100倍,高露洁棕榄上涨760倍，宝洁公司上涨513倍,None,华发股份,1,different
1052,rt,忍受不住折磨，买了,None,宝钛股份,1,same
1092,己经拿到30万股，明天再进20万股,己经拿到30万股，明天再进20万股,None,海泰发展,1,same
1093,私摹通知卖。买将井喷的上海重组第一股600355,私摹通知卖。买将井喷的上海重组第一股600355,None,亚通股份,2,different
1094,上升通道已打开！ ！,调整要到底了，准备上攻，上升通道已打开！ ！,None,中粮屯河,1,same
1122,本人看盘买入，明天低开再入，和腾讯合股的，要和阿里一较高下！坚决看好,看中其和腾讯合股民营银行,股东,健康元,1,same
1141,这可是杭汽轮b另一个重磅利好呀。杭州银行上市随时可能出公告的，到时想买也买不到了。,客观预计，杭州银行今年上市概率80%，明年上市100%,None,杭汽轮B,1,different
1218,...,洗盘已经完成 筹码蓄积完毕庄家强力出击直指15元,None,动力源,1,different
1231,请大家理性的思索判断，估计下四川金顶这次估计能涨到多少价格，能涨停几次,四川金顶到底能涨多少,None,四川金顶,1,different
1233,000420三天的洗盘结束，已经稳妥步入上升通道，建议加仓或半仓买入,吉林花纤洗盘结束，步入上升通道,股东,吉林化纤,1,same
1238,招商我看好你哦，必大涨,银行强中强,None,招商银行,1,same
1260,守的云开见月明,守的云开见月明,None,吉恩镍业,1,different
1263,这次一定不能卖，看看大盘指数就知道牛市已经来了，龙大一定会上40,这次一定不能卖，看看大盘指数就知道牛市已经来了，龙大一定会上40,股东,龙大肉食,1,same
1297,奥拓13块的本，现在能不能补仓啊？我只想摊低成本，好快点跑,奥拓13块的本，现在能不能补仓啊？我只想摊低成本，好快点跑,股东,奥拓电子,0,different
1325,老子的长青股份赚钱了，气死上海股友。,气死“上海股友”,股东,长青股份,1,different
1329,业绩为王，其他都即把白扯。,多头行情吊炸天，老板电器发力。,股东,老板电器,1,different
1356,假若提前知道会连拉13个涨停板！你该怎么办 ？回顾  002354 科冕木业 连拉 13 个涨停板；,《》假若提前知道会连拉13个涨停板！,股东,常发股份,1,different
1371,如题,再来个涨停，涨上去了没那么容易跌下去！,None,美锦能源,1,same
1389,压得不错等我有色出完就回来加仓你,好蛋定的主力,None,冠农股份,1,different
1451,期待,哇塞，中标阿根廷项目,None,湘电股份,1,different
1464,当心马上涨停！,当心马上涨停！,None,国中水务,1,different
1466,别婆婆妈妈了、赶快涨上去、往“涨停”赶,别婆婆妈妈了、赶快涨上去、往“涨停”赶,股东,国中水务,1,same
1496,买点  13.60就走人  同意吗？,买点  13.60就走人  同意吗？,股东,首旅酒店,1,different
1511,回踩位置大概在4.18左右，以供参考，当然，不排除主力强拉上5元以上,超级大户主力前两个交易日净流入4000万资金，估计会凶猛回踩洗盘,股东,长春经开,1,different
1517,这股我跟踪了好几年了，此次拉升，至少看高在6元以上，一定要坚决持有,至少看高在6元以上，一定要坚决持有,None,长春经开,1,same
1549,短期阻力9.28缓涨吞前期9.28长上引,短期阻力9.28缓涨吞前期9.28长上引,None,同方股份,1,different
1559,大盘强势多日，海越个股不涨反压，且无利空，故可断定庄家筹码锁定良好，目前借大势反压震筹，下午大盘稳定于此点位时，拉升。个人意见，仅供参考。,庄家筹码锁定强，及时介入。,股东,海越股份,1,different
1612,把我有限的低价股机会,国栋建设一只低价极品黑马即将发射主力吸货多时了,股东,国栋建设,1,different
1661,成了，10个板上30；不成补涨2个板。拥有同达的小伙伴们，可以泡妞去了,不关重组成与不成，大家都无须担心,股东,同达创业,1,different
1711,如果没猜错，今天4.9上方见，大家继续奋战吧，希望不要倒在黎明前，信不信由你，反正我是信了,如果没猜错，今天4.9上方见，大家继续奋战吧，希望不要倒在黎明前，信不信由你，,股东,红豆股份,1,different
1718,002533中国航空母舰专用电线的供货商,002533中国航空母舰专用电线,None,金杯电工,2,different
1740,抢抢抢要发财就买禾欣股份,抢抢抢要发财就买禾欣股份,股东,禾欣股份,1,different
1765,"看好后期发展,已建仓.4.98元.",与你共进退.,None,国中水务,1,different
1767,前期积压太多。。今天保8%很好了。。如果流入超5千万继续看好,前期积压太多。。今天保8%很好了。。如果流入超5千万继续看好,股东,国中水务,1,different
1769,东风科技：国企、小盘、绩优、成长、与德企合作，老庄走了新庄也会进驻。,600081,股东,东风科技,1,different
1809,飞天华发！,苦等己成昨曰黄花，华发之路金光闪闪。,None,华发股份,1,different
1817,我就不信你不补涨，最低先看到12元,我就不信你不补涨，最低先看到12元,股东,风神股份,1,different
1828,现在买进！,现在买进！,None,中兴商业,1,same
1868,10：50左右，买盘剩7万多手，照这样下去，封不死涨停哦。。。。。。,10：50左右，买盘剩7万多手，照这样下去，封不死涨停哦。。。。。。,None,新华龙,1,different
1878,该股走势呈多头排列 股价已经高于5天十天线 以后将持续疯涨 今天大盘涨了块30个点了 现在还可以继续买入！庄家资金还在流入 下午将继续爆发,平庄能源动态分析,None,平庄能源,1,same
1924,热烈祝贺株冶集团股价突破9元大关,热烈祝贺株冶集团股价突破9元大关,股东,株冶集团,1,different
1929,凯撒目前已经到了前面的成交平台（10.5附近），如果能够有偏利好的消息，随时上涨。如果一直盘，跌破平台，就等9元附近的大平台。,凯撒的支撑,None,凯撒股份,2,different
1932,龙大快涨停了，快入啊！,龙大快涨停了，快入啊！,None,龙大肉食,1,same
1947,有钱的，都再加点火，冲过去！,48-51是强阴力位。所以要整几下，过去了，就一飘云天了！,None,广晟有色,1,different
1950,今天的走势一是试盘，二是要筹码，此股主力意在长远,善意提醒，大家有钱就买点富维吧，此股主力意在长远,None,一汽富维,1,different
1955,我在等加仓机会！目前半仓！,81/815/918/101军工股有的是机会上！,None,海兰信,1,different
1965,这次拉升怕是不涨就难了，有大单光临了，在不买明天就进不去了,这次拉升怕是不涨就难了，有大单光临了，在不买明天就进不去了[鼓掌][鼓掌],股东,梅花生物,1,same
1967,买,次新股集体大涨，弟兄们别怕，冲啊！,None,龙大肉食,1,same
2006,不到15不放手！这波行情坚信会到15以上。,不到15不放手！,None,江淮汽车,1,same
2037,次新股登云股份拉开次新股炒作行情，金莱特等新股可低吸。,次新股登云股份拉开次新股炒作行情，金莱特等新股可低吸。,股东,登云股份,1,same
2042,上证指数这波怎么看都有个大行情。看华泽这波能有多高。,上证指数这波怎么看都有个大行情。看华泽这波能有多高。,股东,华泽钴镍,1,same
2058,两点以后拉涨停,两点以后拉涨停,None,中珠控股,1,same
2059,,大盘 突破 2177 前高 600568破10哈 哈 哈 漂亮,股东,中珠控股,1,different
2112,拭目以待,逢低买进，耐心持有，必有厚报！,None,天成控股,1,same
2126,看看2000585是怎么发射的,国栋建设即将成为川股战神,股东,国栋建设,1,same
2183,20000亿立方米！页岩气!!,600157！主力实力强大！,None,神州信息,1,same
2190,如题,20元见吧！,股东,维尔利,2,different
2197,野猪也有发情的时候，高潮到了，这周难道真会上12元？？？？？？？？？,这周难道真上12元？？？,None,株冶集团,1,same
2225,想逆天而动，看你个瓜娃子还能折腾多长时间,把泰山搬来也压不住了,None,劲嘉股份,0,different
2230,再买1000,再买1000,股东,千方科技,1,same
2245,超级恶心的庄，洗筹打压不遗余力，压不住多久的,超级恶心的庄，洗筹打压不遗余力，压不住多久的,None,中新药业,1,same
2288,再不买进停牌以后就没有买进的机会了。好股票不多，汉缆是今年的大黑马,快买,None,汉缆股份,1,same
2309,大行情来了，,大行情来了，,股东,温州宏丰,1,same
2317,冲啊     兄弟们,宏源证券影子股     大家顶起来,股东,锦江投资,1,same
2370,煤炭业毕竟还是能源基础，改不了,煤炭业毕竟还是能源基础，改不了,None,红阳能源,1,same
4207,一群王八狗托,唱多的王八都死了吧,None,时代新材,0,different
4220,那1847股被吃掉了吗？金宇集团还是弱势格局。,那1847股被吃掉了吗？金宇集团还是弱势格局。,股东,科力远,0,different
4225,6.3什么时候能解套,6.3什么时候能解套,None,大有能源,0,different
4231,完了 一切都完了,完了 一切都完了,None,奇正藏药,0,same
4235,你们的投资公司那里去了，饭桶！,麻痹，总市值偏低！好歹也要40-50亿！,None,永鼎股份,0,different
4246,要砸盘了，大家快跑,要砸盘了，大家快跑,股东,华纺股份,0,same
4252,还不走等待何时！,还不走等待何时！,None,贵研铂业,0,same
4256,！！！！！！！,-一日游呀！,None,西南证券,0,same
4260,股吧,大盘涨这么多，三水一直趴着不动，难道不是高管无能，耻辱啊！,None,三峡水利,0,same
4271,只有人气旺盛，主力操作才轻松，运作起来灵活自如,对华业评论，华业庄家不正干，不知股票越涨越有人气,None,华业地产,2,different
4290,？,2年来果冻头上总有抛不完的盘，而且才11亿流通,None,国栋建设,0,same
4295,人福也是sh300的标的，不跌停，你没有尿，哈哈,主力，有种你就来个跌停版,None,人福医药,0,different
4314,卖出，让庄自己玩去！！,卖出，让庄自己玩去！！,股东,动力源,0,different
4320,让他,惨到没有跟风盘。,None,维科精华,0,same
4336,今天高兴的嘞。,上海那个孽挫老买了远方就不要涨，哈哈，气死他。,None,远方光电,0,different
4346,今年没有下跌，所以短线不会上涨，明日继续下跌毫不犹豫清仓顺鑫农业。,今年没有下跌，所以短线不会上涨，明日继续下跌毫不犹豫清仓顺鑫农业。,None,顺鑫农业,0,same
4372,肥猪跳起来......等待的是屠杀!!!,"正告红源猪力_____在大盘蹦溃之前,请自性堕落",None,红阳能源,0,different
4423,3月25号 7月8号都是放量涨后基本见顶了 这次和7月8号尤其相似 长长的上影线后会不会再阴跌或盘整啊，不到10个亿的盘，那么小的盘庄家都控制不了，拉不起来，我只能说太弱了。历史可能要重演。,历史总在重演,股东,华东重机,0,same
4424,两天见分晓,可能要做头耶!,None,宝钛股份,2,different
4425,幸好今天换了光线传媒,幸好今天换了光线传媒,None,华数传媒,0,different
4426,逃顶啊！！！！！！,逃顶啊！！！！！！,None,宝钛股份,0,same
4439,垃圾股呀！搞飞机呀,大盘都涨飞天了，我们还被关着，天理不容,股东,星美联合,0,different
4443,10元都上不去,10元都上不去,None,喜临门,0,different
4473,大盘今天是年内最高了，广晟应也是年内最高了，今天追高的朋友，也许来年会给你惊喜，没带干粮的赶紧打道回府,大盘今天是年内最高了，广晟应也是年内最高了,None,广晟有色,0,same
4474,36买入等于买套！,为什么要买入002368？,None,太极股份,0,same
4481,有挣没挣，先跑吧,这种业绩，支撑不了大涨,None,广晟有色,0,same
4489,死了,"追高被套了,完了",股东,世纪华通,0,different
4491,贱股啊，罢了罢了，输给你了，愿持有者多福。,贱股啊，罢了罢了，输给你了，愿持有者多福。,None,海鸥卫浴,0,same
4499,大家不要上当！,300065又来钓鱼了！,None,海兰信,0,same
4503,神马股，大盘涨它不涨，大盘跌它比兔子跑的都快。,神马股，大盘涨它不涨，大盘跌它比兔子跑的都快。,None,东光微电,0,same
4507,抛盘如涛涛洪水，死人缺钱钱了嗦,抛盘如涛涛洪水，死人缺钱钱了嗦[成交][成交][成交],None,银轮股份,0,different
4535,高抛低吸,哈哈.我逢高卖完了.明天跌下来又买,None,京投银泰,0,different
4549,彻底歇菜路,彻底歇菜路,股东,曙光股份,0,same
4557,山顶上好多SB在站岗，主力决定不拉，在底在接这些侉比割肉盘，哈哈哈哈。！！！！,号外！号外！龙大最新消息！！,股东,龙大肉食,0,different
4577,换股,大家还是庆幸吧，股指倘若回调，日上至少跌5个点以上,None,日上集团,0,same
4586,真的不知道庄家什么意思，就算随波逐浪也应该涨一点啊这么简单的道理我想庄家不会不懂吧，庄家应该不会傻过我吧,什么意思啊，别的稀土永磁最近都一直涨的很好唯独他不涨。,None,太原刚玉,0,different
4604,开始要跌了！走人！！！,已经卖了！,股东,龙星化工,0,same
4607,还涨 只会涨不上了吧,还涨 只会涨不上了吧,None,江中药业,1,different
4614,无法放量，只能下跌！,无法放量，只能下跌！,None,东方创业,0,same
4633,意欲为何？,股市在暴涨，谁在打压三力士？,None,三力士,0,different
4636,"再好的汽车从4元炒到13了,一年翻了三信高位放量,以出货为主了,小心","再好的汽车从4元炒到13了,一年翻了三信高位放量,以出货为主了,小心",股东,江淮汽车,0,same
4638,1000元,跑,None,栖霞建设,0,different
4640,二百五！,二百五！,股东,厦门钨业,0,different
4644,这是要泛绿的节奏，有意思,这是要泛绿的节奏，有意思,None,厦门钨业,0,same
4660,升势已到位，撤退！,国元证券下午逐波盘跌，日K线上影。,None,国元证券,0,same
4666,出货坚决,出货坚决,None,国发股份,0,same
4674,贵研铂业近期距离35元目标还远！,贵研铂业近期距离35元目标还远！,股东,贵研铂业,2,different
4705,雅致是头猪  人涨它不涨 人跌它狂跌 老娘一生气 全部扫出去 马勒隔壁!!!!!,雅致是猪,None,雅致股份,0,same
4736,什么情况,大盘在涨，他在跌,股东,宏达股份,0,different
4748,草,发的什么破新闻，主力想要跑路吧，主力掩护小散先走,None,天马精化,0,different
4764,拉坯憋屎,我真是没有耐心了.果断斩仓.,None,键桥通讯,0,same
4767,这个烂货股究竟属那个板块，只跟跌的板块,这个烂货股究竟属那个板块，只跟跌的板块[不赞],None,华胜天成,0,same
4770,落袋为安,已走,股东,升华拜克,0,same
4778,大家撤吧,大盘明日暴跌补缺口,None,联美控股,0,same
4779,终于卖了，垃圾到极点的股，错过了大好的行情。,真是，钢铁股不能沾，谁沾谁死。,None,山东钢铁,0,same
4798,哈哈。600297完了吧！,哈哈。600297完了吧！,None,美罗药业,0,different
3005,今天来看看600008，还是阿斗啊。,真是扶不起来的。。。,股东,首创股份,0,same
3021,短期没有机会,调整周期，至少在7个交易日左右,股东,国电南自,0,same
3025,在2级市场上想买小散户的筹码很难，压住盘面的价格直接到 大宗交易里买筹码，价格压制住了大宗交易交易的成本也控制住了,知道为什么主力不 拉高吗,None,中江地产,2,different
3032,这个垃圾看来真的是要破产了！！！！！,耻辱！,None,*ST精功,0,same
3039,6.67追击祁连山。,好像还是250的节奏，暂不介入,None,桂冠电力,0,same
3041,它马的大盘涨，它i不涨，快跑,它马的大盘涨，它i不涨，快跑,股东,紫江企业,0,same
3043,庄家在疯狂出货，估计中报不好,庄家在疯狂出货，估计中报不好[哭],None,铜峰电子,0,same
3050,健桥是一支病猫。油盐不进。面对大盘如此高歌猛进，它稳坐不动是么原因,健桥是一支病猫。油盐不进。面对大盘如此高歌猛进，它稳坐不动是么原因,股东,键桥通讯,0,same
3055,多小散,没戏别指望,None,海泰发展,0,same
3067,真是垃圾,真是垃圾,股东,克明面业,0,same
3075,人家涨得一塌糊涂，你在这里观赏祖国山河一片红，弱弱问句：你可以跟上组织吗？,说爱你不易呀,None,威海广泰,0,same
3076,散场吧 别幻想了 调整时间过长了 一个像样的涨停都没有,如果不是登云涨停 龙大不知道跌哪去了,股东,龙大肉食,0,same
3077,这只股为什么大盘升这么多，还跌！！！,这只股为什么大盘升这么多，还跌！！！,股东,威海广泰,0,same
3105,小散们，不要浪费时间在这破锅上，聪明的人都去买蓝筹股了，机会不等人，抓紧时间。,小散们，不要浪费时间在这破锅上，聪明的人都去买蓝筹股了，机会不等人，抓紧时间。,None,杭锅股份,0,same
3107,好在上星期换成了金融股...哈哈,回来看看傻鸟股！,None,罗莱家纺,0,same
3145,怎样，看到了吧，马上就要大跌了哦，幸好早上全部卖了哦，赶紧跌停吧，我再全仓买进哈哈哈哈,怎样，看到了吧，马上就要大跌了哦,股东,株冶集团,0,same
3161,大概率事件,下午大盘回落，亚宝破9元,None,亚宝药业,0,different
3170,/,大 盘 高 位 长样到顶明显 下午600568爹 听///,股东,中珠控股,0,different
3200,大盘将挑战2265，尚有百点空间，此股大户却还在洗盘（出货？），留下100股，看你如何表演。开辟新战场了，88。,此处大户无视大盘暴涨,股东,华智控股,0,same
3223,江淮汽车就是扶不正的阿斗，大家快跑吧！,江淮汽车就是扶不正的阿斗，大家快跑吧！,股东,江淮汽车,0,same
3247,奶奶的，买错了，明天换，领头羊能翻几倍，吃屁的能跟着涨二三十点就不错了,靠，原来中粮地产是领头羊，这个只是跟着吃屁的,None,中粮屯河,0,same
3283,不看了，越看越不可耐，处理掉省心省力，到10月都不会有什么起色，走,不看了，越看越不可耐，处理掉省心省力，到10月都不会有什么起色，走[兴奋][兴奋,None,厦门空港,0,same
3299,庄和董事长死了，坚决卖了,狗罗消息,None,美罗药业,0,same
3333,这个垃圾还会跌,3.83卖了换大盘股，越大盘越涨,股东,江山化工,0,different
3366,别追涨哦，要站岗的，大股东大量出货，一上48就出,别追涨哦,None,广晟有色,0,same
3412,比白菜还便宜，买几斤吃吃,因为价低,股东,岳阳林纸,1,different
3442,弱B恒弱,737走势早知道：收盘早泄均价以下，明天低开2个点,None,中粮屯河,0,same
3451,名副其实的垃圾股,名副其实的垃圾股,None,华胜天成,0,same
3456,怎么这般熊样,怎么这般熊样[不屑],股东,国中水务,0,different
3505,如题,久盘必跌！,None,曙光股份,0,same
3553,主力持续多日净流出，创业板已是昨日黄花，主板才是新的投资平台.,28日上午主力净流产200多万，下午有可能跌停！,股东,联创节能,0,same
3561,彻底套牢！13.50元买入,彻底套牢！13.50元买入,股东,奥拓电子,0,same
3564,如题,如果大盘调整，北京城建将转跌！,None,北京城建,0,same
2404,压盘，压盘，压你M的盘,压盘，压盘，压你M的盘,股东,宏达股份,0,different
2410,/,危险  爹   听     了  闪 ///,股东,中珠控股,0,same
2415,不会进,问题股票现在只有出,股东,锦江股份,0,same
2423,,今天钢联会跌停吗,股东,上海钢联,0,different
2426,。,猪力你给点力啊 难道去抢交通银行了？,股东,中粮屯河,0,different
2427,感觉玩的太夸张了吧。,感觉玩的太夸张了吧。,None,蒙草抗旱,2,different
2436,汽车股开始没落了,银行 券商 带领大盘向上冲了,None,江淮汽车,0,same
2437,好牛逼的大连控股，超越大盘，狂跌啊！,好牛逼的大连控股，超越大盘，狂跌啊！,None,大连控股,0,different
2440,小心为妙,封板量能比较小，后续连扳有待观察,股东,*ST合泰,0,same
2446,4444444,清仓。狗杂,股东,实益达,0,same
2450,/,大盘张听 600568爹听 快跑 ///,股东,中珠控股,0,same
2467,涨幅前三的板块市盈率和业绩并没吸引力。会不会是神经套？试目以待,涨幅前三的板块市盈率和业绩并没吸引力。会不会是神经套？试目以待,None,美锦能源,2,different
2482,都是小散在意淫或者是主力要出货了，放出的风声！,股市根本不存在所谓的漏网之鱼！切记切记！,股东,亿阳信通,0,same
2492,大盘下跌，，标准没涨就要跟跌 500百手以上的大单全是抛 此股无庄 很快就会跌成绿,大盘下跌，，标准没涨就要跟跌 500百手以上的大单全是抛 此股无庄,None,标准股份,0,different
2498,东安4.50是头部，我清仓了。,东安4.50是头部，我清仓了。,None,*ST东安,0,same
2519,大跌,下午大跌，重大立空出来了,None,首钢股份,0,different
2526,主力赚2毛就抛货，剩下一些作融券，,都说是垃圾，走啊！,股东,美尔雅,0,different
2544,闪人，晕倒，就这股，能赚到钱也不合算，弄的天天心情不好,闪人，晕倒，就这股，能赚到钱也不合算，弄的天天心情不好,None,ST景谷,0,different
2582,这些年这么好的行情不多见！叉！我滴 股票还在跌。。,赶紧跑吧，明天再继续接地气！,股东,动力源,0,same
2589,庄家又在对倒，股价并没有上升，这个狗庄太垃圾，想出票，应拉高。,庄家又在对倒，股价并没有上升，这个狗庄太垃圾，想出票，应拉高。,None,理工监测,0,different
