3650,套我九个月，今天终于解套了，出了,套我九个月，今天终于解套了，出了,股东,大有能源,0,same
4666,出货坚决,出货坚决,None,国发股份,0,same
103,希望越大，失望越大。你以为你们都是神？还10元呢？不亏本赶紧跑吧！,希望越大，失望越大。你以为你们都是神？还10元呢？不亏本赶紧跑吧！,股东,山西焦化,0,same
1760,这个垃圾,又要跌了,None,喜临门,0,same
1140,跌停买点儿,跌停买点儿,股东,通葡股份,1,different
3603,我换银行股了美罗药业你去死吧,庄家的2014年7月28日妈妈死了,None,美罗药业,0,same
4347,哪些无良养的在砸？,哪些无良养的在砸？,股东,锦龙股份,0,different
960,什么破股票，这大盘都涨27点了他吗的还跌，要死啊。,死股,None,梦洁家纺,0,same
2532,6元卖了，大盘要回调了，跌下来再进,6元卖了，大盘要回调了，跌下来再进,None,美尔雅,0,same
1648,指望猪给你带来什么？,养猪的都是垃圾股！,None,新五丰,0,different
2436,汽车股开始没落了,银行 券商 带领大盘向上冲了,None,江淮汽车,0,same
3273,张不上去,张不上去,None,荣华实业,0,same
1425,这股难炒,远远落后于大盘,None,中新药业,0,same
1346,,[哭][哭][哭][哭][哭],股东,当代东方,0,different
3080,世界第一垃圾股！！！两市除一只股票下跌外其他全部涨停，这只下跌股就是600727！！！,600727下午跌停！,None,鲁北化工,0,same
1316,不注重市值管理，不作为，轻视投资者，就来个脚投票吧,做空这垃圾笑话股吧，来个脚投票,股东,中国医药,0,different
2345,我孤注一掷，坚守三个月，已经被逼疯！,我孤注一掷，坚守三个月，已经被逼疯！,None,亚宝药业,0,different
3997,这个股没大庄，只有几个折腾的大户。10--11元会折腾好久。中报和第三季度报业绩都是很差。,10个点利润坚决跑，10元买，11元卖,None,联美控股,0,same
500,猪,垃圾猪,None,海兰信,0,same
4033,呵呵,怎么，没人出声啦？哀莫大于心死，这衰庄完啦！,股东,维科精华,2,different
1727,在大盘暴涨之时，平高居然疯狂杀跌，有没有天理啊,在大盘暴涨之时，平高居然疯狂杀跌，有没有天理啊,None,平高电气,0,different
4462,600066可能会下跌20%，快跑！,600066可能会下跌20%,None,宇通客车,0,same
3986,796,离开的时候有些话还没来德及说,None,易食股份,2,different
4222,半仓不管你折腾,没有大单。不加仓,None,上海电力,0,same
1998,，，，垃圾,，，，垃圾,股东,江淮汽车,0,same
2710,大家都涨疯了。你丫的傻比，我都不知道说你什么好。气的我快吐血了。,王八蛋就是王八蛋,股东,万邦达,0,different
4573,谁的种,全中国的股票都牛了；难到你是只怀孕的母牛‘跑不懂,股东,中炬高新,0,different
1387,今天大盘涨了两个点，咱们管农还这样半死不活的，大盘要是不涨呢？管农会降多少，自己看着办吧，朋友们,今天大盘涨了两个点，咱们管农还这样半死不活的，大盘要是不涨呢？管农会降多少，自己,None,冠农股份,0,different
1675,股价很难突破5元，撤退为上策,股价很难突破5元，撤退为上策,股东,曙光股份,0,same
212,踏空资金汹涌入场，新股将发生踩踏事件空头一败涂地鸟兽散,踏空资金汹涌入场，新股将发生踩踏事件空头一败涂地鸟兽散,None,龙大肉食,1,different
1337,"医药股此次也有轮翻上涨大盘上涨更不用说了跌幅较大连像样的反弹也没有没有什么好说的,抓紧时间清仓吧",没有清仓京新的抓紧时间清仓此股,None,京新药业,0,same
2726,千手大单即将买入了，往上看涨停了！,千手大单即将买入了，往上看涨停了！,股东,东诚药业,1,different
3066,在一波大行情中最可怕的不是不涨，而是别人热点轮换赚80%，你守弱股赚10%,在一波大行情中最可怕的不是不涨，而是别人热点轮换赚80%，你守弱股赚10%,None,建设机械,1,different
2415,不会进,问题股票现在只有出,股东,锦江股份,0,same
759,反面无情之人不可交他,持有此股的朋友注意了...,None,尔康制药,0,different
4530,rt,这么明显的出货，为什么就有人接呢？,None,威远生化,0,same
4400,大善人88是好人，看多的都是托，跑吧,不知182猴年马月会股改,None,S佳通,0,same
3086,奇葩！60分线还有3天调整,我 擦 ！这 几 把 烂 股 ！,None,亚通股份,0,same
1583,我们散户给你玩的不行 了,又要开始暴跌了，我先走了再说，主力不是好人,股东,维科精华,0,same
4226,你到底属于主板，还是题材。。难道你只会跌????,你到底属于主板，还是题材。。难道你只会跌????,股东,同仁堂,0,same
1214,尼玛自选股就你一个绿。2话不说卖你丫的。,尼玛自选股就你一个绿。2话不说卖你丫的。,股东,动力源,0,same
4284,卖了在说吧落袋维安,卖了再说,None,宝硕股份,0,same
1865,"亿利达前期涨得太厉害了,不知不觉中从去年的11块多一点都涨到现在最高25.16元了,涨了一年的时间,现在能不跌吗?再用大半年的时间悄悄地跌回去.",亿利达将缓慢地跌跌不休了,None,亿利达,0,same
2459,信不,弱势依旧，不看好,股东,钱江生化,0,same
3387,我的10元买的要到2100年解套了,我的10元买的要到2100年解套了,None,三一重工,0,same
3032,这个垃圾看来真的是要破产了！！！！！,耻辱！,None,*ST精功,0,same
4220,那1847股被吃掉了吗？金宇集团还是弱势格局。,那1847股被吃掉了吗？金宇集团还是弱势格局。,股东,科力远,0,different
1553,狗东西，股市大涨时你停牌，复牌时来10个跌停板吧！,狗东西，股市大涨时你停牌！,None,农发种业,0,same
2436,汽车股开始没落了,银行 券商 带领大盘向上冲了,None,江淮汽车,0,same
1834,20元买的，能解套吗？,20元买的，能解套吗？,None,启源装备,0,different
424,减持公司股票表明公司运行困难，暂不可介入。,公司运行困难,None,澳洋科技,0,same
1455,赶紧割了换银行吧,大杨就像老太太的裹脚布，又长又臭,None,大杨创世,0,different
3121,明天出半年报，今天大盘涨这么多2588却只拉了这么点，说明半年报可能并不乐观，大盘回落可能股价就要大幅度回调。担心。,明天出半年报，估计不好,None,史丹利,0,same
3618,今天的走势果不出我所料，下午再盘下去吧,庄家快看,None,科达股份,0,same
4241,再看看这个垃圾，几天把几个月的套牢盘放在上方，弱庄情以何堪,看看动力源走得多漂亮，上方没什么压力，随时可以拉涨停,None,国电南自,0,different
2602,多次提醒大家 没有最低只有更低 被跟趋势作对 否则你会si的很惨，今天必跌5个点以上 下午还有两个点,多次提醒大家 没有最低只有更低 你信不？,None,平高电气,0,same
3644,呵呵,散户们，千万不要接货，这垃圾题材 业绩什么都没，怎炒？,股东,维科精华,0,same
1359,走势凶险，卖出的节奏。,高危!,None,千金药业,0,same
1898,股价很难突破5元高位，慎重买入！前高5.35之后步入下跌走势,股价很难突破5元高位，慎重买入！前高5.35之后步入下跌走势,股东,曙光股份,0,same
1795,看多的太多。。。。。。。。庄家是不会给拉的,走吧，下跌中继,None,国电南自,0,different
2451,/,大 盘 到 顶 了 跑啊 ///,股东,中珠控股,0,same
1441,做空的傻逼，你他妈就是一坨屎,做空的傻逼，你他妈就是一坨屎,None,柳化股份,0,different
4377,你个垃圾股，你到底想怎样！好歹还是预盈预增的啊，这么个走法，想不通啊！,你个垃圾股，你到底想怎样！好歹还是预盈预增的啊，这么个走法，想不通啊！,股东,京新药业,0,different
2861,坚决卖，下午大跌！！！,出货行情，一个字——卖！,None,中国国贸,0,same
1850,全球共振产业大家皆大欢喜你下来,全球共振产业大家皆大欢喜你下来,股东,江海股份,2,different
1551,垃圾股,垃圾股[滴汗],None,中国玻纤,0,same
2241,600243这畜生真的是垃圾，大盘涨得这么厉害它装死，大盘跌，它比大盘还跌得快，600243吃吧,垃圾,None,青海华鼎,0,same
3626,恨死它了，我要是出来发誓都不碰它了，再也不看一眼。,300304到底有什么好的，垃圾一个。,None,云意电气,0,same
4936,老总都快失业了机构庄都要死了,改名北方失业,None,北方创业,0,same
677,大盘的涨跌已经和它没关系了，赵为了自己的目的......近期想挣钱的请绕道！,这股已经被赵兴龙完全捂住了,None,东方金钰,0,different
4657,"基金太多丶游资不参与`再多利好也没有用`慢慢遨吧`朋友们`我走,,了丶坐高铁去丶此车太慢`还要晚点丶.","基金太多丶游资不参与`再多利好也没有用`慢慢遨吧`朋友们`我走,,了丶坐高铁去丶",None,江淮汽车,0,same
1553,狗东西，股市大涨时你停牌，复牌时来10个跌停板吧！,狗东西，股市大涨时你停牌！,None,农发种业,0,same
4262,（1）现场会议召开时间：2014年8月11日（周一）14：30（2）网络投票时间：2014年8月11日9:30—11:30，13:00—15:00股东们都来投反对票！！！！,董事会对股民不负责，坚决反对他们的所有提议！,None,武汉控股,2,different
3688,下午必跌,下午必跌,None,南京高科,0,same
4276,国资委的垃圾股赶快卖,长春经开 会不会最近设立民营银行，敬请期待中,None,长春经开,0,same
1506,直接走人,那些喊涨的垃圾人都滚蛋，这股那么菜怎么会涨了，走人,股东,维科精华,0,different
1271,真奇葩啊，吧里除了小散和骗人入群的顶贴外，什么也没有,真奇葩啊,None,天奇股份,2,different
2596,获利盘依然很多！没有办法！上涨不会有！！！,获利盘依然很多！没有办法！上涨不会有！！！,None,华胜天成,0,same
4071,抛盘如雨！,抛盘如雨！,None,全柴动力,0,same
871,哈哈哈,成功出掉依顿。哈哈哈！开始搞地产去了！2货们继续套着吧！,股东,龙大肉食,0,same
4663,不要左，要右。,有宗申垫底，以后闭着眼睛买股票了！,None,宗申动力,2,different
4224,如题。呵呵,在3.38和3.41挂万手买单的骗子哪去了？,None,万通地产,2,different
4663,不要左，要右。,有宗申垫底，以后闭着眼睛买股票了！,None,宗申动力,2,different
4730,真的垃圾股,2475,股东,立讯精密,0,same
705,这庄真沉得住气，好几次被气出去过了,好沉稳啊,None,传化股份,2,different
3710,宜通世纪主力己经无心恋战，起码中线是没有机会了。,宜通世纪主力己经无心恋战，起码中线是没有机会了。,None,宜通世纪,0,same
1861,此股已死。浪费了大好行情！有人！,此股已死。浪费了大好行情！有人！,股东,亿利达,0,same
3644,呵呵,散户们，千万不要接货，这垃圾题材 业绩什么都没，怎炒？,股东,维科精华,0,same
3161,大概率事件,下午大盘回落，亚宝破9元,None,亚宝药业,0,different
3714,坚决别碰,主力出货明显，此股要远离,None,东百集团,0,same
628,学会等待！,还不跑就在等死！——7.50见！,None,长城电工,0,same
2359,从盘口看抛压坚决，略有反弹即有抛盘涌出，不太妙,抛压很重,None,平高电气,0,same
3002,快,银行暴动大盘完蛋天量天价快卖,None,工商银行,0,same
1021,手中有股，心中无股。,持有此股的朋友注意了...,None,澳洋科技,2,different
4428,跑,跑,None,中央商场,0,same
4011,？,看似又是短期头部，将等待182反复,None,国栋建设,0,same
2649,大盘沿着5曰线上行，你沿着5口线下行，亏了我一万多，你怎么这么丛，气死我],大盘沿着5曰线上行，你沿着5口线下行，亏了我一万多，你怎么这么丛，气死我],None,龙源技术,0,different
3888,看多的这么多，必跌，跟风上来，好不了，同志们，还是散了吧，买煤炭和券商吧,看多的这么多，必跌,None,国电南自,0,same
2534,大盘暴涨它不涨，此中必有隐情，会隐藏什么样的大利空呢？散户要慎重思考咯！小心下午暴跌？,广州发展下午真的要暴跌吗？散户逃命？,None,广州发展,0,different
4191,均线压着上不去了！快走吧！,均线压着上不去了！快走吧！,None,银鸽投资,0,same
1966,大盘股天下，换股券商股,8元，下坠下坠！自由落体！,None,亚宝药业,0,same
2299,上星期国泰君安诊断：该股为亏损,不知道各位注意了没有国泰君安诊断：该股为绩差,None,*ST商城,0,same
2710,大家都涨疯了。你丫的傻比，我都不知道说你什么好。气的我快吐血了。,王八蛋就是王八蛋,股东,万邦达,0,different
645,现在出!收盘进！抓紧出啊,现在出!收盘进！抓紧出啊,None,置信电气,0,same
3333,这个垃圾还会跌,3.83卖了换大盘股，越大盘越涨,股东,江山化工,0,different
56,不以涨喜，不以跌悲。,拉升背后，主力的真正意图已经表现出来了。,None,双钱股份,0,same
2582,这些年这么好的行情不多见！叉！我滴 股票还在跌。。,赶紧跑吧，明天再继续接地气！,股东,动力源,0,same
3091,。。。。。。。,6.90元的大托单马上被吃掉！,股东,精工钢构,0,same
3473,买入002245不是好事。广股也就涨到这了,买入002245不是好事。广股也就涨到这了,None,澳洋顺昌,0,same
242,1,拉升背后，主力的真正意图已经表现出来了。,None,恒基达鑫,2,different
743,涨你妹了，都他妈是托,涨你妹了,None,华胜天成,0,same
2733,迅速逃顶。。。只跟跌不跟涨 不会有机会翻身 即将跌破翻绿,迅速逃顶。。。只跟跌不跟涨 不会有机会翻身,None,标准股份,0,same
3208,打死都不要买国元这个垃圾股,打死都不要买国元这个垃圾股,股东,国元证券,0,same
4549,彻底歇菜路,彻底歇菜路,股东,曙光股份,0,same
1879,主力正在拉高出货，快跑！,主力正在拉高出货，快跑！,None,乐凯胶片,0,same
1758,不要碰这垃圾了，本来还想补来着，去他吗的抛了走人,大盘涨百天，它还在原地踏步，草他吗的走了,None,喜临门,0,different
433,开盘就跑，收盘1.64以下,开盘就跑，收盘1.64以下,None,*ST南钢,0,same
4303,叼尼老姆嗨丫，大盘涨了200点了。尼丫的不动下,哈哈哈，叼尼老姆嗨丫，大盘涨了200点了。尼丫的不动下,None,柳化股份,0,different
3192,地产也行,全仓买入券商保险银行煤炭有色 抛弃一切股票,None,中粮屯河,0,same
697,确实是无力，北方创业强势很多,确实是无力，北方创业强势很多,股东,时代新材,0,same
4416,唐传勤是个！！！！,好当家主力在拼命压盘可能是社保建仓！因为好当家让社保亏得一塌糊涂！,股东,好当家,0,different
13,在公司主页科技创新栏有介绍,丰乐搞转基因，复盘是否跌停板？,None,丰乐种业,0,same
4242,没实力完意,换股了，真墨迹。垃圾,None,金鹰股份,0,same
1572,果然被益生股份甩开几条街。,果然被益生股份甩开几条街。,None,*ST民和,0,different
4395,0,再见，阿斗000796,None,易食股份,0,same
1590,全体涨它趴着，真见其性。,宁波联合龟性大发,None,宁波联合,0,different
830,真是垃圾了？,申万概念股大涨与神奇没有关系吗,None,神奇制药,2,different
3035,卧槽了个DJ,煤炭都抽风了。。你还能沉住气啊,股东,大有能源,1,different
1279,此股在这个价位价值已现，再买进的话，价格已高，又要站岗了！,此股在这个价位价值已现，再买进的话，价格已高，又要站岗了！,股东,老板电器,0,different
2413,涨不过指数农药股!老话久盘必跌。,涨不过指数农药股!老话久盘必跌。,None,长青股份,0,same
4927,大盘要跳水了,大盘要跳水了,股东,升华拜克,0,same
3025,在2级市场上想买小散户的筹码很难，压住盘面的价格直接到 大宗交易里买筹码，价格压制住了大宗交易交易的成本也控制住了,知道为什么主力不 拉高吗,None,中江地产,2,different
2831,如题,上周五买得好爽，这周突破上去，涨停,None,华芳纺织,1,different
484,太多人唱多 看来这股要跌了 其实是没有重组 公告没看到吗 修改过了也得两年 最后还是没重组,太多人唱多 看来这股要跌了 其实是没有重组 公告没看到吗 修改过了也得两年 最后还是,None,红阳能源,0,same
1217,坚持不住了，卖掉了，大盘涨成这样，换股了！,坚持不住了，卖掉了，大盘涨成这样，换股了！,None,大连控股,0,same
2904,走为上,割肉走了，大盘疯涨，这货疯跌，走为上,None,中房地产,0,same
1974,银行，地产，眉飞色舞大盘股都在涨，在掩护小盘股出货，股吧内高手已经撤退散户可怜，散户小心啊,没有富维股票但发现它横盘派发筹码散户小心,None,一汽富维,0,different
1346,,[哭][哭][哭][哭][哭],股东,当代东方,0,different
1000,实在太高,辉煌两天跌掉10%，上涨从来不超过5%，就这瘟神，谁要谁倒八辈子大霉,None,辉煌科技,0,same
3329,股市淘金者中国梦之流，就是垃圾,股吧来了不少托，坚决卖出,None,振华科技,0,same
132,不妙,大家都在狂欢时，注意撤退呀,None,西南证券,0,same
4491,贱股啊，罢了罢了，输给你了，愿持有者多福。,贱股啊，罢了罢了，输给你了，愿持有者多福。,None,海鸥卫浴,0,same
2069,大家要有心理准备,韶钢又将被ST,None,韶钢松山,0,same
3860,哈哈,小心我抛770万股原始股 不要吓死奥,股东,苏交科,0,different
3247,奶奶的，买错了，明天换，领头羊能翻几倍，吃屁的能跟着涨二三十点就不错了,靠，原来中粮地产是领头羊，这个只是跟着吃屁的,None,中粮屯河,0,same
3729,放量滞胀，短调,放量滞胀，短调,None,兴发集团,0,same
4591,就这价了  涨不了啊。,就这价了  涨不了啊。,None,襄阳轴承,0,same
3176,,看还要跌哦，还要退市呢。,None,韶钢松山,0,same
927,小散擦亮眼睛，不要上当，好股票多的是啊,狗庄玩花活想脱身？,None,山西焦化,0,different
2100,缩量上涨，必死无疑，跑了,缩量上涨，必死无疑，跑了,None,东睦股份,0,same
4256,！！！！！！！,-一日游呀！,None,西南证券,0,same
1373,418去死吧，阳萎,418去死吧,None,江淮汽车,0,different
2390,干不过主力，哥先走了，让主力慢慢玩,干不过主力，哥先走了，让主力慢慢玩,None,江淮汽车,0,same
1274,兄弟们赶快买煤炭，有色，券商，我猜对了大盘，没猜对各股，哭死。,兄弟们赶快买煤炭，有色，券商，我猜对了大盘，没猜对各股，哭死。,股东,国电南自,0,different
3902,量能没出来，走不远,不放量，一切都是浮云,None,九州通,0,same
4050,黑庄，鉴定完毕,黑庄，鉴定完毕,None,山东药玻,0,different
3190,出货,中粮屯河一一一一一一不用质疑它确实在出货,None,中粮屯河,0,same
4821,超级垃圾，就是不拉，好吧，大家拿着看谁先承不住气,扶不上墙了烂泥,None,新黄浦,0,same
2533,买入阳泉煤业,什么破股啊 害我错过一轮行情,None,宜安科技,0,different
3332,不好意思，心里承受不了，7.7全部清场,不好意思，心里承受不了，7.7全部清场,None,洛阳钼业,0,same
4503,神马股，大盘涨它不涨，大盘跌它比兔子跑的都快。,神马股，大盘涨它不涨，大盘跌它比兔子跑的都快。,None,东光微电,0,same
1485,受不了了，卖了,受不了了，卖了,None,中电远达,0,same
759,反面无情之人不可交他,持有此股的朋友注意了...,None,尔康制药,0,different
2092,长安别追高，观望，暂不宜介入！,长安别追高，观望，暂不宜介入！,股东,长安汽车,0,same
2413,涨不过指数农药股!老话久盘必跌。,涨不过指数农药股!老话久盘必跌。,None,长青股份,0,same
4610,持有九鼎新材的散户终于明白什么是傻吊了！就是你自己！,持有九鼎新材的散户终于明白什么是傻吊了！,股东,九鼎新材,0,different
982,今天跌停概率较大，注意风险！,今天跌停概率较大，注意风险！,None,贵研铂业,0,same
3033,希望大家赚大钱我先走啦,6块强力阻力位  我先走了,股东,大有能源,0,same
1380,买进就停什么意思？,请问高手，什么时候复盘呀？,股东,四川金顶,2,different
1330,美亚，还会有一跌！,美亚，还会有一跌！,股东,美亚光电,0,same
3672,"300130，不多说了 ，创业板暴跌,泥沙俱下，重组、业绩自己看，题材、概念自己找","权重股到头了，曝光翻倍黑马,底部横盘1年多 股东人数减少38%",None,古越龙山,0,same
4258,rt,600116涨一个点等同于涨停了,None,三峡水利,1,different
953,主力熊样了，涨一次就出货了，大家买吧。看好的,出货了，不要命的赶紧买阿,None,健康元,0,same
1148,我先出来了。,涨势不涨，接下来将面临大跌,None,波导股份,0,same
1430,志同道合的小散朋友们，不要听垃圾托唱多，该跑就跑吧，明显的主力减持,2649主力在不断减仓！,股东,博彦科技,0,different
2232,祝坚守的弟兄们好运。,有点高，出来歇歇,None,洛阳钼业,0,same
1663,可怜  可怜我们吧,开滦的大户 又要逃了，大盘都涨那样了，还跌啊``郁闷哦  15员怎么解套,None,开滦股份,0,different
4497,还在不停地卖股？葬你家全族是吧！,申猴子家一户口本要多少钱来葬啊？,股东,海兰信,0,different
3998,各种资源都在涨，国新算什么？,各种资源都在涨，国新算什么？,股东,国新能源,2,different
3175,此股庄家实力太差，大盘涨了这么多，他还不借力发力，还等待何时？,此股庄家实力太差,股东,江淮汽车,0,same
1532,没戏，就一频临倒闭的不可重组的垃圾公司，死前讲什么石墨烯故事为的是套钱，告这垃圾公司！,没戏，就一频临倒闭的不可重组的垃圾公司，死前讲什么石墨烯故事为的是套钱，告这垃圾,None,维科精华,0,different
1369,这破股还是不动，大家别了这股吧，此股是概念股，消息不来一切都是枉然，好股现在多的是，有大家选的,银行板块真突破太疯狂了，此此是真突破,None,美锦能源,0,different
2735,换股，宏图估计还要磨很长时间，过段时间可能还是这个价，或许还会低一点,换股，宏图估计还要磨很长时间，过段时间可能还是这个价，或许还会低一点,股东,宏图高科,0,same
1320,散户惜筹不卖 狗庄伟哥即将生效,散户惜筹不卖 狗庄伟哥即将生效,股东,中国医药,1,different
4189,这个破股怎么股性这么死呢，按理说题材挺丰富的啊,这个破股怎么股性这么死呢，按理说题材挺丰富的啊,None,山东高速,0,same
500,猪,垃圾猪,None,海兰信,0,same
3206,建议大家卖出000728换入涨幅少的601688,建议大家卖出000728换入涨幅少的601688,None,国元证券,0,same
1027,你大爷！,你大爷！,股东,红豆股份,0,same
1775,是否有吞大便的恶心感呢？,那些总是喊口号的大便们,None,首创股份,0,different
1255,市面上任何一只股票都比这熊票强。,奉劝各位如果你解套了，别犹豫了，远离这熊票,股东,司尔特,0,same
2865,妈的，大盘，金通灵就这熊样，全抛进北化,死货,None,金通灵,0,same
859,麻痹，丧心病狂主力全家光,真的不觉得这种股要这样砸,None,国统股份,0,different
3784,日吴家它祖宗,14.2元4万股日上，不解套绝不退出，该死的吴家,None,日上集团,2,different
637,好不容易大盘来一波行情，它停了,悲催的金利呀,None,金利科技,0,same
1278,我可以骂人吗？，看看这几天大盘的走势，再看看南自，庄家我去年买了个表,我可以骂人吗？，看看这几天大盘的走势，再看看南自，庄家我去年买了个表,None,国电南自,0,different
1875,老子买在了最高点。,老子买在了最高点。,None,长春燃气,0,same
3694,,去年涨得太多，今年大跌也很正常,None,天成控股,0,same
473,/,记住 现在 可以下 9.99出 600568 ///,股东,中珠控股,0,same
1700,今天试盘啊，无奈横盘时间太久，套牢盘太多，估计要再震荡下,今天试盘啊，无奈横盘时间太久，套牢盘太多，估计要再震荡下,None,顺鑫农业,2,different
3672,"300130，不多说了 ，创业板暴跌,泥沙俱下，重组、业绩自己看，题材、概念自己找","权重股到头了，曝光翻倍黑马,底部横盘1年多 股东人数减少38%",None,古越龙山,0,same
4777,此股最大的特点是：一追就套,此股最大的特点是：一追就套,None,全柴动力,0,same
826,恬不知耻，厚颜无耻，苟延残喘。。。。。。。,无耻的垃圾股,股东,广东榕泰,0,same
2980,此股已死！,大盘涨这麽多，这股真孙子,None,常林股份,0,different
4208,垃圾,大牛之相是假。口蹄疫之症才是真-垃圾,None,波导股份,0,same
