1548,600033是我30多支自选股里倒数第一，不抱什么幻想了,2。34割肉，看的眼红，连续几天跑不赢大盘，不意淫了,股东,福建高速,0,same
4257,大家挺住,已卖出华纺股份,股东,华纺股份,0,different
1208,比大盘还弱，压盘如山啊！,来看看多少人无语了，垂头丧气地交枪了。,None,*ST商城,0,same
570,还好早早出了，买其它股都赚5%了，他还在这磨叽磨叽的！,还好早早出了，买其它股都赚5%了，他还在这磨叽磨叽的！,股东,中兴商业,0,same
827,还在这里守着呢,这就是悲剧哈，呵呵呵。都懂了吗,None,丹化科技,0,different
1870,出货的杂种们 你们怎么想的 你们怎么不回头看看这个垃圾跌了多少 这么好的行情 就死在你们手了,出货的杂种们 你们怎么想的 你们怎么不回头看看这个垃圾跌了多少 这么好的行情,股东,通宝能源,0,different
648,卖出,周一不下跌3个点就不错了,None,三峡水利,0,same
4252,还不走等待何时！,还不走等待何时！,None,贵研铂业,0,same
4333,不压住你是我们的孙子！,SB庄压住,None,东百集团,0,different
1458,卖了卖了,草他吗的，随便换股票都可以啊,股东,维科精华,0,different
234,垃圾主力！！,不信还会跌，今天还继续跌给你看,None,渤海活塞,0,same
4320,让他,惨到没有跟风盘。,None,维科精华,0,same
648,卖出,周一不下跌3个点就不错了,None,三峡水利,0,same
4784,散户还在接，怎么涨！,散户还在接，怎么涨！,股东,中炬高新,0,different
3030,没戏,银轮为什么不被市场认可？,None,银轮股份,0,same
1041,"md,终于卖完了！再也不碰你了！烂腚","md,终于卖完了！再也不碰你了！烂腚",None,蓝鼎控股,0,same
2079,看你上当吗,中粮屯河一一一一z站不住6元一一一一一套人行情,None,中粮屯河,0,same
2593,"看着像头牛,就是上不去。牛皮一拉掉，原来是头熊。","看着像头牛,就是上不去。牛皮一拉掉，原来是头熊。",None,金河生物,0,same
674,垃圾呀，不知道还有红色，浪费时间，换其他股早赚了，割了也赚回来了，没希望的垃圾！,垃圾呀，不知道还有红色，浪费时间，换其他股早赚了，割了也赚回来了，没希望的垃圾！,None,维科精华,0,same
1433,大盘涨，银鸽跌,大盘涨，银鸽跌,None,银鸽投资,0,different
1385,今天大盘涨了两个点，咱们管农还这样半死不活的，大盘要是不涨呢？管农会降多少，自己看着办吧，朋友们,今天大盘涨了两个点，咱们管农还这样半死不活的，大盘要是不涨呢？管农会降多少，自己,None,冠农股份,0,different
1591,赌重组的注定是赚了指数不赚钱。赌棍能赚钱吗？哈哈！一帮赌重组的垃圾，去死吧！！！,赌重组的注定是赚了指数不赚钱。赌棍能赚钱吗？哈哈！,None,南方汇通,0,different
697,确实是无力，北方创业强势很多,确实是无力，北方创业强势很多,股东,时代新材,0,same
2435,要涨停版,要涨停版,股东,思源电气,1,different
301,"慢慢敖吧,1亿的获利盘要跑了!","增发机构解禁,这个股会连续下杀到6元!",股东,长城电工,0,same
1104,冲高抛压好重,冲高抛压好重,None,红阳能源,0,different
4412,中亏小心,这烂股，整天装疯买傻的,None,哈高科,0,same
4235,你们的投资公司那里去了，饭桶！,麻痹，总市值偏低！好歹也要40-50亿！,None,永鼎股份,0,different
3835,不要相信卖软件的,不要相信卖软件的,股东,天瑞仪器,0,different
1002,什么情况？怎么压单被吃了啊。今天不是不能涨过9毛7么？,什么情况？怎么压单被吃了啊。,None,深振业A,2,different
1330,美亚，还会有一跌！,美亚，还会有一跌！,股东,美亚光电,0,same
4731,巢东主力无力呀？,巢东主力无力呀？,股东,巢东股份,2,different
816,买入为宜,谢谢主力，今天跌停吧，老子建仓军工,None,哈飞股份,1,different
902,晕聋瘟神,空王吧走了没有?不走不涨啊,None,吉林森工,0,different
1587,郁闷啊，赶快出了的好,什么垃圾啊，我买大盘也比你好的多了,股东,维科精华,0,different
4587,万紫千红一点绿,这地方还真环保,None,一汽富维,0,different
2373,哎！,我怕来不及，我要抱着你，可是你已离我而去。。。。,None,吉恩镍业,0,different
4897,割肉了 不玩了 一直亏损 没有题材了,割肉了 不玩了 一直亏损 没有题材了,None,新五丰,0,same
1421,走,走了，无语,None,中牧股份,0,same
2577,大盘涨幅过大，本周必有回调，注意002196跟风洗盘，先落袋为安，等待时机在抢入。,注意躲避风险,None,方正电机,0,same
1734,.,垃圾.换了2718,None,思美传媒,0,same
2359,从盘口看抛压坚决，略有反弹即有抛盘涌出，不太妙,抛压很重,None,平高电气,0,same
797,垃圾股票,垃圾股票,None,九州通,0,same
4907,.,快跑吧,股东,华润锦华,0,same
2558,在低位，且5个交易日内跑输大盘的股不足百只，而铁龙名列前茅，够狠，我服了，真服了,买了这只王八，我都不好意思跟别人说我炒股了,None,铁龙物流,0,different
4601,最好逃命的机会！,最好逃命的机会！,None,华电能源,0,same
3746,任何时候都要有清醒的头脑，这个市场圈钱的本性不变。,圈钱目标不变,None,工商银行,0,different
3603,我换银行股了美罗药业你去死吧,庄家的2014年7月28日妈妈死了,None,美罗药业,0,same
1467,没有庄家的垃圾股，买股要选强庄家！,没有庄家,股东,天成控股,0,different
1468,赶紧,卖卖卖,None,三元股份,0,same
4374,4元时咋没人叫好，13了叫好？？小心,4元时咋没人叫好，13了叫好？？小心,股东,江淮汽车,0,same
234,垃圾主力！！,不信还会跌，今天还继续跌给你看,None,渤海活塞,0,same
2404,压盘，压盘，压你M的盘,压盘，压盘，压你M的盘,股东,宏达股份,0,different
3176,,看还要跌哦，还要退市呢。,None,韶钢松山,0,same
958,哈哈,今天清仓中孚,None,华泽钴镍,0,same
2984,早盘6.05快速出逃，进金钼。继续择机出掉金马所有股票，投入到有色板块。个人认为再在这里恐怕要等到花儿都谢了！这就叫顺势。,顺势,None,通化金马,0,same
1324,赶紧逃大顶吧Sb！,赶紧逃大顶吧Sb！,None,美盈森,0,same
3729,放量滞胀，短调,放量滞胀，短调,None,兴发集团,0,same
3012,他妈的啥时候不停大盘好转了停了 婊子东西,他妈的啥时候不停大盘好转了停了 婊子东西,股东,合众思壮,0,same
4235,你们的投资公司那里去了，饭桶！,麻痹，总市值偏低！好歹也要40-50亿！,None,永鼎股份,0,different
1277,大盘好啊  被关着  爽不  hpx,大盘好啊  被关着  爽不  hpx,None,四川金顶,0,different
4225,6.3什么时候能解套,6.3什么时候能解套,None,大有能源,0,different
150,操盘团队首席执行官透露，因散户惜售严重，上缴筹码不够，决定今天继续下杀3——4个点，将所有散户一网打尽，后期走势待操盘情况再定。,操盘团队首席执行官透露：今天继续下杀3——4个点。,股东,动力源,0,same
1721,做空银行股正当时,做空银行股正当时,None,招商银行,0,same
4336,今天高兴的嘞。,上海那个孽挫老买了远方就不要涨，哈哈，气死他。,None,远方光电,0,different
893,相信我不错,大家快跑 买大盘股煤炭和有色  中小盘进入新一轮的杀跌开始，不要问我叫什么，我的名,股东,思源电气,0,same
3769,出大问题啦！据说有机构正在打压吸筹，小心啦！,完了！完了！！,None,美亚光电,0,same
2233,赶快走了吧 没戏,赶快走了吧 没戏,股东,冠农股份,0,same
4535,高抛低吸,哈哈.我逢高卖完了.明天跌下来又买,None,京投银泰,0,different
1076,大盘飞涨你却狂跌，只有与主力共为灰烬！跌吧,大盘飞涨你却狂跌，只有与主力共为灰烬！跌吧,None,宏达新材,0,same
1348,看看你！你就跌，不给面子！龟儿子,看看你！你就跌，不给面子！龟儿子,股东,当代东方,0,different
2861,坚决卖，下午大跌！！！,出货行情，一个字——卖！,None,中国国贸,0,same
3006,。,中国的股市，赚钱不卖就是大S。三天不卖赚钱变被套！,None,广晟有色,0,different
2158,开盘就卖了,开盘就卖了,股东,哈高科,0,same
3337,跌停再补仓！,操，狗主力。跌吧有本事跌停！,None,迪森股份,0,different
1056,继续割肉！！！还是在割几个交易日，,继续割肉！！！,股东,栋梁新材,0,different
4481,有挣没挣，先跑吧,这种业绩，支撑不了大涨,None,广晟有色,0,same
1532,没戏，就一频临倒闭的不可重组的垃圾公司，死前讲什么石墨烯故事为的是套钱，告这垃圾公司！,没戏，就一频临倒闭的不可重组的垃圾公司，死前讲什么石墨烯故事为的是套钱，告这垃圾,None,维科精华,0,different
4767,这个烂货股究竟属那个板块，只跟跌的板块,这个烂货股究竟属那个板块，只跟跌的板块[不赞],None,华胜天成,0,same
1146,垃圾庄,波导庄：自虐的时间也够长了，太过了怕自己醒不了啦。,None,波导股份,0,different
4191,均线压着上不去了！快走吧！,均线压着上不去了！快走吧！,None,银鸽投资,0,same
3905,狗日的，大盘都漲了45点了，你妈妈还不动，畜牲！,狗日的，大盘都漲了45点了，你妈妈还不动，畜牲！,None,均胜电子,0,same
553,散户会跟风买进 起码要上午震荡一下,哈哈哈 主力啊你筹码搜集不够 千万不能开在11元以上 不然,None,华胜天成,2,different
3914,9.36将是年内高点,9.36将是年内高点,股东,精诚铜业,2,different
1789,大盘涨成这样，你TM的狗日的，卖了。,大盘涨成这样，你TM的狗日的，卖了。,股东,国电南自,0,same
4539,逆市垃圾，小心,沪市只90家下跌，均胜不幸位列其中,None,均胜电子,0,same
4226,你到底属于主板，还是题材。。难道你只会跌????,你到底属于主板，还是题材。。难道你只会跌????,股东,同仁堂,0,same
1414,垃圾股，跌个没玩没了了。,这么好的大盘，这垃圾股走成这样，换其他股早赚翻了,None,新纶科技,0,same
2279,可以走了,没有跑赢大盘，弱,股东,新日恒力,0,same
3043,庄家在疯狂出货，估计中报不好,庄家在疯狂出货，估计中报不好[哭],None,铜峰电子,0,same
3438,111,呵呵，下午要翻绿了,股东,恒邦股份,0,same
1708,指数涨了3%了，金河就是垃圾,指数涨了3%了，金河就是垃圾,None,金河生物,0,different
4167,唱多的都在自掘坟墓,唱多的都在自掘坟墓,None,博彦科技,0,same
1619,烂股，高管不停的卖，业绩差，没有题材可以炒作，兄弟支持不,烂股，高管不停的卖，业绩差，没有题材可以炒作，兄弟支持不,None,理工监测,0,different
4500,上午的地点，下午打穿 只有更低 没有最低。,上午的地点，下午打穿 只有更低 没有最低。,None,平高电气,0,same
2352,庄托太多快跑,奉劝大家一句话,None,日上集团,0,same
4112,一滩,狗屎,股东,国电南自,0,different
938,一帮sb.亏死，洗毛盘,一帮sb.亏死，洗毛盘,股东,中南建设,0,same
1684,真TM的畜生。前段时间中小板创业板指数上涨它不动。现在上指成指上涨还是半死不活。究竟是只神马票啊？,真TM的畜生。前段时间中小板创业板指数上涨它不动。现在上指成指上涨还是半死不活,None,瑞和股份,0,different
941,人可以无知，但不可无耻！,送：戏耍中珠呆庄,None,中珠控股,0,different
836,这个庄狗实在了得，空盘的肯定是前世做太监的！,这个庄狗实在了得，空盘的肯定是前世做太监的！,股东,广汽集团,0,different
869,这种垃圾看这个走势鸟业绩就肯定是差的一塌糊涂的，赶紧跑吧，反正我是走了不赌了哦,这种垃圾看这个走势鸟业绩就肯定是差的一塌糊涂的,股东,株冶集团,0,same
4965,走了,其他股票都大幅拉升就这垃圾股不动,股东,梅花生物,0,same
624,都不高开，要跌的节奏,都不高开，要跌的节奏,股东,中电远达,0,same
1637,不吹不会死的，越吹死得越快,福建厦门对它没关系，更何况平潭了，不要天天在吧里吹了,股东,建研集团,0,different
1862,泽熙去吃屎了吧,泽熙去吃屎了吧,None,工大首创,0,different
3569,谢谢啊.....,"今天卖了江中，获利1.2元,总算松口气",None,江中药业,0,different
1591,赌重组的注定是赚了指数不赚钱。赌棍能赚钱吗？哈哈！一帮赌重组的垃圾，去死吧！！！,赌重组的注定是赚了指数不赚钱。赌棍能赚钱吗？哈哈！,None,南方汇通,0,different
1791,傻逼啊，跌成这样还叫好,傻逼啊，跌成这样还叫好,None,国电南自,0,different
2437,好牛逼的大连控股，超越大盘，狂跌啊！,好牛逼的大连控股，超越大盘，狂跌啊！,None,大连控股,0,different
2095,看涨得多，肯定还有一深跌！,看涨得多，肯定还有一深跌！,股东,华智控股,0,same
1037,双头已成必下跌。,双头,None,精艺股份,0,same
4702,操泥妈，烂股,操泥妈，烂股,None,澳洋顺昌,0,different
4051,我靠,大盘都比这个傻逼股强 草,None,天通股份,0,same
3014,垃圾股，最多值12元,垃圾股，最多值12元,股东,三全食品,0,same
961,全世界都升你就跌,全世界都升你就跌,股东,中文传媒,0,same
3387,我的10元买的要到2100年解套了,我的10元买的要到2100年解套了,None,三一重工,0,same
2091,把机会错过了可惜！,主板大涨，不要在这破股上浪费时间了,股东,科大讯飞,0,same
3847,快跑啊,"主力偷偷出货，快跑,下午必开板！",None,新华龙,0,same
1267,RT,我是脑抽了卖了导航买创业，这个不死不活的,None,北方创业,0,different
4447,主力你赢了，没去买计划内的鑫龙电器却鬼使神差接了你的货。明天不要低开太多，下手留情一点吧,主力你赢了，没去买计划内的鑫龙电器却鬼使神差接了你的货。明天不要低开太多，下手留,None,龙宇燃油,0,same
3113,端個板凳看跳水,端個板凳看跳水,None,中房地产,0,same
398,,山东泰安股友 已经被中猪严重套4漂亮啊,股东,中珠控股,0,same
1834,20元买的，能解套吗？,20元买的，能解套吗？,None,启源装备,0,different
838,走了！不玩了!,那么多的抛盘不妙啊！,None,上海科技,0,same
2795,上海电力你这样萎靡不振你妈妈知道吗？,上海电力你这样萎靡不振你妈妈知道吗？,股东,上海电力,0,different
922,谁不卖谁是笨蛋,谁不卖谁是笨蛋,股东,华胜天成,0,same
90,今日中阴，有阵雨,今日中阴，有阵雨 午后雷电,股东,大亚科技,0,same
339,逢均线支撑点买入，拉高就出货，准备波段操作，马上就会有较大的回调了,逢均线支撑点买入，拉高就出货，准备波段操作，马上就会有较大的回调了,None,宝钛股份,0,same
3042,主力出货！吸货不会涨停！,我也卖了，不打开涨停就卖！,股东,新华龙,0,different
679,住出门被撞死0728,住出门被撞死0728,None,柳化股份,0,different
3889,再见垃圾股，业绩太差，看不到希望合理估值最多在4、5元,再见垃圾股，看不到希望,None,精艺股份,0,same
2873,好开始爆肚了。久盘必跌!,好开始爆肚了。久盘必跌!,None,长青股份,0,same
1095,主力无耻嘴脸毕露无疑，就是向下,主力无耻嘴脸毕露无疑，就是向下,None,亚宝药业,0,same
2036,都说药玻是慢牛。我看是属蜗牛属性的龙虾。且慢且倒退,都说药玻是慢牛。我看是属蜗牛属性的龙虾。且慢且倒退,None,山东药玻,0,same
424,减持公司股票表明公司运行困难，暂不可介入。,公司运行困难,None,澳洋科技,0,same
2715,奶奶的,老子割肉走人了，居然还有人在耗,股东,亿阳信通,0,same
2403,人都走光了,重组是不是失败了，这么个走势是失败的迹象。,股东,圣莱达,0,same
3946,"车从4元炒到13了,一年翻了三倍高位放量,以出货为主了,小心","从4元炒到13了,一年翻了三倍位放量,以出货为主了,小心",股东,江淮汽车,0,same
4276,国资委的垃圾股赶快卖,长春经开 会不会最近设立民营银行，敬请期待中,None,长春经开,0,same
4013,你明白,山西人刚刚从南京回来,None,南京高科,2,different
4735,手贱5.7追进被套,手贱5.7追进被套,股东,三一重工,0,same
4154,大盘涨了3个点，迪马还在拉垃链，市场第一垃圾股。,大盘涨了3个点，迪马还在拉垃链，市场第一垃圾股。,None,迪马股份,0,same
4303,叼尼老姆嗨丫，大盘涨了200点了。尼丫的不动下,哈哈哈，叼尼老姆嗨丫，大盘涨了200点了。尼丫的不动下,None,柳化股份,0,different
4847,为什么？求解,大盘走的很好　　这股为什么不涨　反而跌呢,None,美亚光电,0,different
4610,持有九鼎新材的散户终于明白什么是傻吊了！就是你自己！,持有九鼎新材的散户终于明白什么是傻吊了！,股东,九鼎新材,0,different
1019,放量了,终于解套了，会涨停吗,股东,乐凯胶片,1,different
891,本次再中签,我来买2028 一买就跌 大家看好,股东,思源电气,0,same
49,准备抛出，终极大熊来了,准备抛出，终极大熊来了,None,江苏索普,0,same
2443,又错过行情了。三元注定是只倒煤的票。,要是上证跌1.5个点，这SB还不得跌停？,None,三元股份,0,different
3835,不要相信卖软件的,不要相信卖软件的,股东,天瑞仪器,0,different
503,人气先起来你要怎么抛都很好跑,抛盘的你等人气凝聚了你在高位抛行不,股东,美尔雅,0,different
1782,如题,蓝筹行情来了，梦洁这样的题材股完蛋了。,None,梦洁家纺,0,same
853,疯狗主力继续往下打啊，8元下几时能捡垃圾哦,疯狗主力继续往下打啊，8元下几时能捡垃圾哦,None,键桥通讯,0,same
2445,一波比一波低,明天必回补缺口，不跑的要当站长了,股东,天龙集团,0,same
3914,9.36将是年内高点,9.36将是年内高点,股东,精诚铜业,2,different
986,此股已废,此股已废,None,华芳纺织,0,same
2278,哈哈,哈哈，二八转换，梦洁被归类题材股了，当蓝筹持有的惨喽。,None,梦洁家纺,0,different
1563,别进。,追个屁，猪力持续出货。,None,动力源,0,different
4282,极度阳痿！,宝硕宝硕，举而不坚坚而不射。阳痿！,股东,宝硕股份,0,different
2135,2014将发生巨亏损，金杯电工受国际铜铝价格大幅反弹影响。。产品价格未能如期上涨，但铜铝原材料大幅上涨已经在二季度末时就体现。。。。,2014将发生巨亏损，受国际铜铝价格大幅反弹影响,None,金杯电工,0,different
2446,4444444,清仓。狗杂,股东,实益达,0,same
403,散户多,中粮屯河一一一一一一一一一开盘大幅度底开压力上面大,None,中粮屯河,0,same
2079,看你上当吗,中粮屯河一一一一z站不住6元一一一一一套人行情,None,中粮屯河,0,same
4607,还涨 只会涨不上了吧,还涨 只会涨不上了吧,None,江中药业,1,different
4462,600066可能会下跌20%，快跑！,600066可能会下跌20%,None,宇通客车,0,same
2593,"看着像头牛,就是上不去。牛皮一拉掉，原来是头熊。","看着像头牛,就是上不去。牛皮一拉掉，原来是头熊。",None,金河生物,0,same
3103,破股，大盘涨成这样都不怎么动一下你来个大跌也好啊死气沉沉的,破股，大盘涨成这样都不怎么动一下你来个大跌也好啊死气沉沉的,股东,中航电测,0,same
3020,海立信：这股均线之下不要进，太差劲，一点动力没有，这股肾亏太重。,海立信：这股均线之下不要进，太差劲，一点动力没有，这股肾亏太重。,股东,海兰信,0,same
4063,出货,出货，出货，二十多万股压下来了，是好时机出货,None,哈高科,0,same
1232,1,不会就涨一天吧,股东,华胜天成,0,different
1124,当前银行的市盈率4倍，向银行股靠齐，将跌破1。5元,逃命！,None,健康元,0,different
1243,巨亏  让垃圾庄跑了,垃圾庄   17.5我没来得及卖出 tnnd,股东,华润锦华,0,same
790,您还要脸吗？078,您还要脸吗？078,None,澄星股份,0,same
3039,6.67追击祁连山。,好像还是250的节奏，暂不介入,None,桂冠电力,0,same
1879,主力正在拉高出货，快跑！,主力正在拉高出货，快跑！,None,乐凯胶片,0,same
158,业级下降，今天低开，快跑。,业级下降，今天低开，快跑。,股东,银河电子,0,same
1153,,阳痿鸡鸡每次冲一下，就阳痿了。哈哈哈,None,华东重机,0,different
1137,强力震仓，小单在捡筹码,制造成交量下跌,None,国旅联合,0,different
405,横盘出货一周了,中粮屯河一一一一一一一开盘大跌主力出逃原因,None,中粮屯河,0,same
2044,看下午如何跳水。。,横盘的目的就是出货。。,None,华泽钴镍,0,same
2036,都说药玻是慢牛。我看是属蜗牛属性的龙虾。且慢且倒退,都说药玻是慢牛。我看是属蜗牛属性的龙虾。且慢且倒退,None,山东药玻,0,same
3032,这个垃圾看来真的是要破产了！！！！！,耻辱！,None,*ST精功,0,same
4151,让庄家慢慢玩去,上27走人，此庄如龟庄。,股东,远方光电,0,different
2609,看分时 现在是横着盘出货 一但主力出得差不多就会狂跌,看分时 现在是横着盘出货 一但主力出得差不多就会狂跌,None,红阳能源,0,different
2779,会不涨停，每天涨个5%-8%。。。,会不涨停，每天涨个5%-8%,股东,三一重工,1,different
4733,你瞎了吗,主力啊你啦啊，看大盘到哪里了,None,上海机场,0,different
1012,如题~~穷地方出恶庄~~刁股瘟股一只！,岳阳林纸真是个瘟股啊~大盘涨那么多它才涨几分~~,None,岳阳林纸,1,different
3398,走吧，还在挺，目前行情，不挣钱就是赔钱。,散户被忽悠扛大旗，主力撤资掘金黑马股,None,亚通股份,0,same
3044,通宝放量不涨！危险期，前期的缺口补掉了，80%会向下走，待时间验证个人关点，不喜勿喷,大盘今天巨量，天量天价！通宝放量不涨！危险期，前期的缺口补掉了,None,通宝能源,0,same
4014,没什么好说的，大盘如此强势，你的个股如果强版块个股的涨幅都没达到，当抛。有色，还是扛大旗的主力。走人。,当涨不涨，抛！,None,厦工股份,0,same
1348,看看你！你就跌，不给面子！龟儿子,看看你！你就跌，不给面子！龟儿子,股东,当代东方,0,different
4046,狗庄大中单在逃,狗庄大中单在逃,None,北方创业,0,same
1775,是否有吞大便的恶心感呢？,那些总是喊口号的大便们,None,首创股份,0,different
361,连续很多天都是主力资金在卖出，看来主力在这个平台走完了。今天很有可能是长淫杀跌。,现在的走法很难看！,None,卧龙地产,0,same
1657,呵呵,买工大还不如买银行股,None,工大首创,0,different
4977,彻底歇菜啦。。。。。,彻底歇菜啦。。。。。,股东,曙光股份,0,same
4777,此股最大的特点是：一追就套,此股最大的特点是：一追就套,None,全柴动力,0,same
3269,6元卖了，大盘要回调了，跌下来再进,6元卖了，大盘要回调了，跌下来再进,None,美尔雅,0,same
608,318你没脸活了,你真NB=每股扣税后派发现金红利0.0665元,None,巢东股份,2,different
1085,垃圾,垃圾,股东,鑫龙电器,0,different
4530,rt,这么明显的出货，为什么就有人接呢？,None,威远生化,0,same
1590,全体涨它趴着，真见其性。,宁波联合龟性大发,None,宁波联合,0,different
3959,太穷鸟！,这庄穷得很！,None,民丰特纸,0,same
634,哥们，搞啥呢！？亏损啊，净资产为负啊！发热了？举报之！,越是垃圾越疯狂，举报之！,None,西藏珠峰,0,different
883,上次说了在9.3左右庄家在出部分获利筹码。狗日的垃圾庄,上次说了在9.3左右庄家在出部分获利筹码。狗日的垃圾庄,股东,日上集团,0,different
122,烂股,烂股,股东,三一重工,0,same
4774,再见！12.62卖了,886,股东,劲嘉股份,0,different
1433,大盘涨，银鸽跌,大盘涨，银鸽跌,None,银鸽投资,0,different
1524,大盘涨多少大股东也会拼命压着不让他涨。,大股东增持不会让股价涨上去，那样成本就高了。,None,天科股份,0,same
171,http://news.ifeng.com/a/20140727/41327883_0.shtml,难怪不涨，利空己明。,股东,宏达股份,0,same
4179,真吓人,600116上面，全是千手万手的卖出单呀,None,三峡水利,0,same
4120,"清仓吧兄弟们,大盘这么涨守着林小姐这只烂股不划算呀你们是什么建议?","清仓吧兄弟们,大盘这么涨守着林小姐这只烂股不划算呀你们是什么建议?",None,中房股份,0,same
3699,龙大就是个狗娘养的，姥姥不疼舅舅不爱，大盘涨了这么多，个股飞上了天，龙大就是又聋又哑,龙大就是个狗娘养的，姥姥不疼舅舅不爱，大盘涨了这么多，个股飞上了天，龙大就是又聋,None,龙大肉食,0,same
3442,弱B恒弱,737走势早知道：收盘早泄均价以下，明天低开2个点,None,中粮屯河,0,same
1533,妖啊妖啊,妖庄把2.16全吃掉抛掉的跳脚了呵和,None,国栋建设,0,different
