4447,主力你赢了，没去买计划内的鑫龙电器却鬼使神差接了你的货。明天不要低开太多，下手留情一点吧,主力你赢了，没去买计划内的鑫龙电器却鬼使神差接了你的货。明天不要低开太多，下手留,None,龙宇燃油,0,same
1480,RT,终于解套了！大盘涨一百点一毛都赚到！MD,None,抚顺特钢,1,different
3299,庄和董事长死了，坚决卖了,狗罗消息,None,美罗药业,0,same
756,烂股,国中水务开盘后快速回落！,None,国中水务,0,same
3688,下午必跌,下午必跌,None,南京高科,0,same
1299,太恶心了这股，大盘都涨200点了，它很淡定,太恶心了这股，大盘都涨200点了，它很淡定,股东,鑫龙电器,0,same
4594,19.80这个地方出了多少抛单！！！大家还是去蓝筹吧,19.80的抛单真多啊，看来还是要去蓝筹啊,股东,千方科技,0,same
1917,29.33买入,29.33买入,股东,登云股份,1,different
1648,指望猪给你带来什么？,养猪的都是垃圾股！,None,新五丰,0,different
4778,大家撤吧,大盘明日暴跌补缺口,None,联美控股,0,same
1158,大家有谁知道原因吗？,为什么就是涨不上去啊，从20多块跌到了16,None,科力远,0,different
3035,卧槽了个DJ,煤炭都抽风了。。你还能沉住气啊,股东,大有能源,1,different
4747,放量滞涨，老股民都知道怎么回事呵呵,放量滞涨，老股民都知道怎么回事呵呵,None,贵研铂业,0,different
1064,恭喜在创业板中小板反弹之际，我大银伦加速翻绿,恭喜在创业板中小板反弹之际，我大银伦加速翻绿,None,银轮股份,0,different
1142,不想说,卖了！,None,柳化股份,0,different
843,今天最少跌2个点,今天最少跌2个点,None,冀东装备,0,same
1489,浪费时间，错过行情,僵死股,股东,ST南化,0,same
1866,出吧,在出货小心,None,工大首创,0,different
1204,大盘贼给力…今天沪市估计成交额得破1500亿…中文就是摸机～再摸大家一起死,大盘贼给力…今天沪市估计成交额得破1500亿…中文就是摸机～再摸大家一起死,股东,中文传媒,0,different
2588,买了这股的真不走运，追其他的接下来也是套的，守这垃圾也是死，没戏！都是这垃圾害人，大家告他！,买了这股的真不走运，追其他的接下来也是套的，守这垃圾也是死，没戏！都是这垃圾害人,None,维科精华,0,different
1296,等着瞧！,中报要亏！,None,桂冠电力,0,same
1822,破股，输给大盘,破股，输给大盘,None,海鸥卫浴,0,different
978,卖，,买入万通的糟塌大好机会，,股东,万通地产,0,same
1781,。。。回落吧 有色 煤炭 地产 崛起的是 石油化工 钢铁 电力 做空期指别想,大板块 再这么连续涨 大盘就真出屏幕了,None,三元股份,0,different
843,今天最少跌2个点,今天最少跌2个点,None,冀东装备,0,same
3746,任何时候都要有清醒的头脑，这个市场圈钱的本性不变。,圈钱目标不变,None,工商银行,0,different
665,大盘五天涨了一百多点，这死股五天还跌了几分钱。谁要是再来翘边，保佑他屁股烂掉！！！,大盘五天涨了一百多点，这死股五天还跌了几分钱。谁要是再来翘边，保佑他屁股烂掉！,股东,广东榕泰,0,same
3754,大盘狂涨，这垃圾不动还下跌，主力缺爹了，老子闪了1000股，赚了老子200块给你女马擦比去,002036真垃圾啊，闪人,None,宜科科技,0,same
1229,老白干近期涨幅超出预期，奉劝跟涨者，千万要小心老白干的大幅回调，不要成为“站岗者”，否则，套你2～3年不商量！！,看谁又会成为老白干“站岗者”？,None,老白干酒,0,different
2982,大单吃完庄家就要洗盘了  大盘大涨 庄家怎么可能把那么低的筹码给大家 反正我是走了  下午跟明天绝对大跌,大单被吃完就要大跌了,None,顺网科技,0,same
4989,所以002231不活跃，也不可能活跃！,只能说大股东一无背景！二无能力！,None,奥维通信,0,different
1319,郁闷,咋停牌了，郁闷，上周五刚卖了，以为今天回调买入。狗主力,None,山西焦化,0,different
4770,落袋为安,已走,股东,升华拜克,0,same
4260,股吧,大盘涨这么多，三水一直趴着不动，难道不是高管无能，耻辱啊！,None,三峡水利,0,same
1590,全体涨它趴着，真见其性。,宁波联合龟性大发,None,宁波联合,0,different
3543,,谁也改变不了的事实，如果没有政府补贴，日上亏损严重,None,日上集团,0,same
678,,又傻了吧，可怜的小散,None,维科精华,0,same
135,柘中中报巨亏，中报前将跌至6.6元附近做平台整理,柘中中报巨亏，中报前将跌至6.6元附近做平台整理,None,柘中建设,0,same
1558,真臭,还不如东华能源,None,海越股份,0,different
2627,热电已经失去最后的一点概念，股东都被抓了，还重组啥呀，不要忘了上次被否就是二股东反对，每次上方都压个大单，明白人都懂得，何去何从，自己掌握！,二股东被抓，放量滞胀。何去何从，自己拿捏！,None,大连热电,0,different
4199,西南证劵真垃圾,西南证劵真垃圾,None,西南证券,0,same
4633,意欲为何？,股市在暴涨，谁在打压三力士？,None,三力士,0,different
2386,日,出！出！出！赶快出，跑啊！,股东,江淮汽车,0,same
2649,大盘沿着5曰线上行，你沿着5口线下行，亏了我一万多，你怎么这么丛，气死我],大盘沿着5曰线上行，你沿着5口线下行，亏了我一万多，你怎么这么丛，气死我],None,龙源技术,0,different
2020,普洛真要变成垃圾了。,普洛真要变成垃圾了。,None,普洛药业,0,same
4162,20走人！,20走人！,None,冠农股份,0,same
3363,,这个价位只卖不买，谁买谁被套，而且深套,None,日上集团,0,same
3021,短期没有机会,调整周期，至少在7个交易日左右,股东,国电南自,0,same
2755,二八轮换。,调仓换股,None,美罗药业,0,different
131,要快,50元出售1股南纸、欲购从速……,None,福建南纸,0,same
4505,太TMD的二百五了。。。,太TMD的二百五了。。。[卖出][卖出][卖出],None,银轮股份,0,same
851,贱种呀贱种，大盘一起你就回家日娘，你看看连新钢股份（600782）都不带你玩了。,贱种呀贱种，大盘一起你就回家日娘，你看看连新钢股份（600782）都不带你玩了。,None,通宝能源,0,same
608,318你没脸活了,你真NB=每股扣税后派发现金红利0.0665元,None,巢东股份,2,different
3793,卖出000728第二理由就是别的证券股上涨资金净流入而000728净流出1500万资金,卖出000728第二理由就是别的证券股上涨资金净流入而000728净流出1500万资金,None,国元证券,0,same
1547,同方，你的涨幅能超过大盘吗？你是什么类型的股票呢？蓝筹？不是，国防军工？不是，LED？不是，安防？不是。信息安全及IT？不是。亏损股？是，垃圾股？是，圈钱股？是,同方，你的涨幅能超过大盘吗？,股东,同方股份,0,different
3223,江淮汽车就是扶不正的阿斗，大家快跑吧！,江淮汽车就是扶不正的阿斗，大家快跑吧！,股东,江淮汽车,0,same
1672,。,要死不活，,股东,厦工股份,0,different
122,烂股,烂股,股东,三一重工,0,same
2640,冒回傻气,4.66元买入的，只求解套，不求获利,None,紫江企业,1,different
4596,我买50000股,惨,股东,千方科技,1,different
732,今天，5.04卖了，5元估计要反复,今天，5.04卖了，5元估计要反复,股东,哈高科,0,same
4611,看见就想笑，是你们水平太高了还是怎么了，哥换股这几天都赚了25%了，算是少的了，看看你们，就一10%的涨幅,舒服，大盘节节高，回头看看美锦的朋友,None,美锦能源,0,same
4862,奸庄，逼我卖吗？,奸庄，逼我卖吗？,股东,安琪酵母,0,different
131,要快,50元出售1股南纸、欲购从速……,None,福建南纸,0,same
3472,换股渤海租赁,4亿多的盘子，可怜的成交量，散户行情，反弹卖出,None,传化股份,0,same
1883,更好解禁套现。,更好解禁套现。,None,长青股份,0,different
1739,再砸一下啊，快点,再往下跌啊，哥在28元等着进点货,None,金证股份,0,different
4568,崩盘了,吃屎控股马上跌停,None,七喜控股,0,same
1581,又想套我们散户了,赶快跑啊，这垃圾又假拉高，完拉，,股东,维科精华,0,different
150,操盘团队首席执行官透露，因散户惜售严重，上缴筹码不够，决定今天继续下杀3——4个点，将所有散户一网打尽，后期走势待操盘情况再定。,操盘团队首席执行官透露：今天继续下杀3——4个点。,股东,动力源,0,same
42,小散不让，只能是挨宰的份。,发优先股是喝老股东的血,None,工商银行,0,same
3213,真是垃圾股  垃圾啊啊,长青老总死了吗  大盘这样都跌,None,长青股份,0,same
1293,我就是希望你砸，砸的越多越好，有种砸到7块,呵呵，谁还看不懂啊，小技俩！托了也没人买！,股东,宜科科技,0,different
4534,后悔!!,后悔!!后悔!!后悔!!...,None,金河生物,0,different
3266,,增发的1.28415亿股在疯狂出逃延长化建！！！,None,延长化建,0,same
756,烂股,国中水务开盘后快速回落！,None,国中水务,0,same
2892,如上,己到卖出时,股东,锦龙股份,0,same
1205,庄家要跑了，同志们，咱们跟着跑啊！！,庄家要跑了，同志们，咱们跟着跑啊！！,股东,曙光股份,0,same
1278,我可以骂人吗？，看看这几天大盘的走势，再看看南自，庄家我去年买了个表,我可以骂人吗？，看看这几天大盘的走势，再看看南自，庄家我去年买了个表,None,国电南自,0,different
4120,"清仓吧兄弟们,大盘这么涨守着林小姐这只烂股不划算呀你们是什么建议?","清仓吧兄弟们,大盘这么涨守着林小姐这只烂股不划算呀你们是什么建议?",None,中房股份,0,same
938,一帮sb.亏死，洗毛盘,一帮sb.亏死，洗毛盘,股东,中南建设,0,same
2940,快跑！要向下打了！,快跑！要向下打了！,None,华英农业,0,same
3436,/,全  是    散      户  快跑///,股东,中珠控股,0,same
928,大盘面临调整，永利必将跟着回调,大盘高位，永利将跟着回调,None,永利带业,0,different
3888,看多的这么多，必跌，跟风上来，好不了，同志们，还是散了吧，买煤炭和券商吧,看多的这么多，必跌,None,国电南自,0,same
3561,彻底套牢！13.50元买入,彻底套牢！13.50元买入,股东,奥拓电子,0,same
838,走了！不玩了!,那么多的抛盘不妙啊！,None,上海科技,0,same
3638,。。,下午将疯狂出出货,None,益生股份,0,same
4757,5.19全部出货。,5.19全部出货。,股东,铁龙物流,0,different
3268,就是垃圾,就是垃圾,股东,国中水务,0,same
3644,呵呵,散户们，千万不要接货，这垃圾题材 业绩什么都没，怎炒？,股东,维科精华,0,same
2354,清仓,走啦，没必要耗在这里了。,None,日上集团,0,same
3361,,快换股，翻翻行情已经展开，日上完蛋了,None,日上集团,0,same
4732,疯狂拉抬在指数掩护下     小庄轻轻地走了，,最后的疯狂,None,露天煤业,0,same
2635,我是没办法换了，14.2元成本，亏了17万，还好4.16元买了8万股陕西煤业，损失找回点，日上只能硬挺，我都恨死吴家了,行情刚刚启动，好多股票蓄势待涨，快换股,None,日上集团,0,same
3005,今天来看看600008，还是阿斗啊。,真是扶不起来的。。。,股东,首创股份,0,same
2595,逃命机会。下跌通道的股。遇涨停坚决抛,逃命机会。下跌通道的股。遇涨停坚决抛,股东,登云股份,0,same
3484,股价应该还有下探空间,股价应该还有下探空间,股东,曙光股份,0,same
2492,大盘下跌，，标准没涨就要跟跌 500百手以上的大单全是抛 此股无庄 很快就会跌成绿,大盘下跌，，标准没涨就要跟跌 500百手以上的大单全是抛 此股无庄,None,标准股份,0,different
1729,我靠，什么垃圾玩意,这个碧昂的傻逼股怎么了 怎么不更大盘的脚步？,None,天通股份,0,different
4035,呵呵,今天涨100点，这个垃圾都收绿，不信？走着瞧！,股东,维科精华,0,same
4071,抛盘如雨！,抛盘如雨！,None,全柴动力,0,same
2413,涨不过指数农药股!老话久盘必跌。,涨不过指数农药股!老话久盘必跌。,None,长青股份,0,same
3466,利润最大化，乐凯近期还会跌点，风格变化,大盘股强，先卖出乐凯，玩大盘,None,乐凯胶片,0,same
1458,卖了卖了,草他吗的，随便换股票都可以啊,股东,维科精华,0,different
2651,即使8元买了也舒服，跌吧。我拿着了,继续跌，在买点，手里没皇台睡不着觉,None,皇台酒业,1,different
2000,以破位走势打击人气，你能怎点新的不。控盘能力也不强，损人不利己。,以破位走势打击人气，你能怎点新的不。控盘能力也不强，损人不利己。,股东,江淮汽车,0,different
226,"煤炭行情即将结束,换股,换股吧!!","煤炭行情即将结束,换股,换股吧!!",None,露天煤业,0,same
1184,太差,太差,None,新日恒力,0,same
1140,跌停买点儿,跌停买点儿,股东,通葡股份,1,different
1415,RT,涨停板出货！够狠的！明天跌停,None,抚顺特钢,0,same
2135,2014将发生巨亏损，金杯电工受国际铜铝价格大幅反弹影响。。产品价格未能如期上涨，但铜铝原材料大幅上涨已经在二季度末时就体现。。。。,2014将发生巨亏损，受国际铜铝价格大幅反弹影响,None,金杯电工,0,different
3720,说你是垃圾，恭维你了，盘子一共10个亿，几个亿的资金能拉到天上去，由此可知，此股庄家垃圾的垃圾！,大盘连涨3天，你却跌了3天。,股东,中房地产,0,same
1646,技术指标马上要下跌，做短差的可以出了，等指标趋势向好接回。,MACD马上绿柱，先撤为妙，善意提醒，不喜勿喷。,None,太化股份,0,different
4155,哈哈,哪位支持罗赖的大虾，把众帮的3000万股解禁股，接过来呀！,None,罗莱家纺,0,different
697,确实是无力，北方创业强势很多,确实是无力，北方创业强势很多,股东,时代新材,0,same
3172,没办法,此股被垃圾中融国际信托打压,None,中珠控股,0,same
3546,恭喜高抛的！！今日不能追进了！收盘上影线！谁买套谁！！,恭喜高抛的！[大笑][大笑][鼓掌]！今日不能追进了！收盘上影线！谁买套谁！！,None,万通地产,0,same
2779,会不涨停，每天涨个5%-8%。。。,会不涨停，每天涨个5%-8%,股东,三一重工,1,different
4052,逆潮流而动，自作聪明，必将自尝苦果！,友情提醒伟星新材主力：,None,伟星新材,0,same
1172,拜拜,"成不了大器,拜拜",None,黑化股份,0,same
2390,干不过主力，哥先走了，让主力慢慢玩,干不过主力，哥先走了，让主力慢慢玩,None,江淮汽车,0,same
1455,赶紧割了换银行吧,大杨就像老太太的裹脚布，又长又臭,None,大杨创世,0,different
415,洛钼被曝有问题，散户趁早另做打算！中国的问题大抵如此，刚开始是曝点料，随后一般都被证实是真实的！既然炒的是钼，何必要一可树上吊死！,别碰问题股！,None,洛阳钼业,0,same
1883,更好解禁套现。,更好解禁套现。,None,长青股份,0,different
855,都是直接往下砸 ，而不是时时出,一直有大量抛单压价,None,京投银泰,0,different
4244,操他妈,这下真明白了，王力民还真是个畜牲呢。,None,华纺股份,2,different
3451,名副其实的垃圾股,名副其实的垃圾股,None,华胜天成,0,same
4507,抛盘如涛涛洪水，死人缺钱钱了嗦,抛盘如涛涛洪水，死人缺钱钱了嗦[成交][成交][成交],None,银轮股份,0,different
4792,如题,散户慎入，此价位你是主力你愿意拉吗？他们在出货。,None,冠农股份,0,same
1567,跌的到挺快,涨点这么费劲,None,动力源,0,different
2104,不会是见光死吧,见光死,股东,健康元,0,same
3473,买入002245不是好事。广股也就涨到这了,买入002245不是好事。广股也就涨到这了,None,澳洋顺昌,0,same
2264,谁追坑谁！中报地雷！快跑,谁追坑谁！中报地雷！快跑,None,华东重机,0,same
1920,大家以为这个垃圾能涨停吗，告诉你们不可能的，反正我已经全部清仓了，对这个垃圾不报希望了，告诉你们下午要大跌，赶紧跑吧,大家以为这个垃圾能涨停吗,股东,株冶集团,0,different
3570,大跌,周线变盘,None,平高电气,0,same
2641,大盘强势上涨、西藏板块强势上涨、资源股强势上涨，天路趁机出货，若是洗盘不该连均价都不守，可怜今天被忽悠进来的了。,下午必跌！,None,西藏天路,0,same
4372,肥猪跳起来......等待的是屠杀!!!,"正告红源猪力_____在大盘蹦溃之前,请自性堕落",None,红阳能源,0,different
1779,到下个月再回来看这股如何？不去理他，看了都难受,到下个月再回来看这股如何？不去理他，看了都难受,股东,中央商场,2,different
1142,不想说,卖了！,None,柳化股份,0,different
401,//,一 个价值 2 元的票 硬被搞到10元 后果很严重 ///,股东,中珠控股,0,same
924,跌，大家都跑吧,跌，大家都跑吧,股东,博通股份,0,same
1996,央视害人,散户跑的快哦。呵呵。都很聪明嘛，下午就变绿。今天追的背套，,股东,江淮汽车,0,same
4525,大盘都涨成那样了千金还不动真是垃圾,垃圾,None,千金药业,0,same
4862,奸庄，逼我卖吗？,奸庄，逼我卖吗？,股东,安琪酵母,0,different
2184,何必单恋一支花。好股票有的是！,坚持不住就走吧,股东,健康元,0,same
1832,垃圾垃圾，换成隆基啦。,和隆基比，就是一太监，可怜的中环。,股东,中环股份,0,different
905,十元的股票把散户吓的。出息。,十元的股票把散户吓的。出息。,股东,江淮汽车,2,different
736,小哈，你给我跌，等我其他股票赚钱了再来好好干你,小哈，你给我跌，等我其他股票赚钱了再来好好干你,股东,哈高科,0,same
2547,想赚快钱的赶紧换股，投资的赶紧关机，不换股不关机，少活10年能怨谁。,想赚快钱的赶紧换股，投资的赶紧关机，不换股不关机，少活10年能怨谁。,股东,中兴商业,0,different
478,真TMD啦及,垃圾股,None,美锦能源,0,same
1490,真是一垃圾股票,卖卖卖卖卖卖，不卖不痛快,股东,维科精华,0,same
1001,420出了，鸟庄,420出了，鸟庄,股东,吉林化纤,0,same
3398,走吧，还在挺，目前行情，不挣钱就是赔钱。,散户被忽悠扛大旗，主力撤资掘金黑马股,None,亚通股份,0,same
3366,别追涨哦，要站岗的，大股东大量出货，一上48就出,别追涨哦,None,广晟有色,0,same
2410,/,危险  爹   听     了  闪 ///,股东,中珠控股,0,same
4927,大盘要跳水了,大盘要跳水了,股东,升华拜克,0,same
3162,端個板凳看跳水,端個板凳看跳水,None,西藏天路,0,same
3865,广州不发展表现太差，为广发默哀一下,国企新一轮改革大幕拉开，广发集团是裸泳还是会被兼并？,None,广州发展,0,same
1225,真的很后悔买了这个股，现在卖又不行．不卖又不涨，别的都在涨,真的很后悔买了这个股，现在卖又不行．不卖又不涨，别的都在涨,股东,安彩高科,0,different
1028,如题,短线看空,股东,华业地产,0,same
2005,刚玉没戏，今逢高走人，亏点再不碰他，太垃圾了,刚玉没戏，今逢高走人，亏点再不碰他，太垃圾了,股东,太原刚玉,0,same
3414,林纸不是好东东。事实胜于雄辩,林纸不是好东东。事实胜于雄辩,None,岳阳林纸,0,same
3170,/,大 盘 高 位 长样到顶明显 下午600568爹 听///,股东,中珠控股,0,different
1962,！！！！！！！！！！！！！！！！！！！,不要再吹嘘你的新产品研发和资本运作了，你就是股市中的瘪三小丑,None,亚宝药业,0,different
3099,指数涨没人买长青。垃圾股鉴定完毕。买了常绿。,指数涨没人买长青。垃圾股鉴定完毕。买了常绿。,None,长青股份,0,same
961,全世界都升你就跌,全世界都升你就跌,股东,中文传媒,0,same
2952,朋友的票都涨停了，我还被套着！人生啊。。。,朋友的票都涨停了，我还被套着！人生啊。。。,None,华数传媒,0,different
1257,即便你是红顶商人，即便你是红色资本家，但在中国几千年的历史，搞企业的和政治牵连，一般结局都很凄凉。,这个二股东估计出不来了，定增也遥遥无期,None,大连热电,0,different
4907,.,快跑吧,股东,华润锦华,0,same
3416,垃圾，每天都是高开低走。信者永生,垃圾，每天都是高开低走。信者永生,None,江淮汽车,0,same
2238,国药废了！撤退,国药废了！撤退[亏大了],股东,国药股份,0,same
2361,想si的体面的就快跑,日线 60分钟双头成立 macd已经出现死叉 盈利快跑 微亏的快逃,None,平高电气,0,same
1277,大盘好啊  被关着  爽不  hpx,大盘好啊  被关着  爽不  hpx,None,四川金顶,0,different
990,"这就是所谓的僵尸股,快进进ST吧","这就是所谓的僵尸股,快进进ST吧",None,中达股份,0,different
2511,大盘上涨五天，又错过上涨的良机。等五天后复牌，又跟着大盘回调。永远不会涨的啊,大盘上涨五天，又错过上涨的良机。等五天后复牌，又跟着大盘回调。永远不会涨的啊,None,山西焦化,0,same
986,此股已废,此股已废,None,华芳纺织,0,same
27,周一暴跌无悬念 呵呵,周一暴跌无悬念 呵呵,None,宜科科技,0,same
2421,不知何年何月得尝所望,不知何年何月得尝所望[赚大了],None,新纶科技,2,different
2605,垃圾,亚宝药业：这样的垃圾股看都不用看。就是臭垃圾一滩。,None,亚宝药业,0,same
1729,我靠，什么垃圾玩意,这个碧昂的傻逼股怎么了 怎么不更大盘的脚步？,None,天通股份,0,different
1966,大盘股天下，换股券商股,8元，下坠下坠！自由落体！,None,亚宝药业,0,same
1978,个人觉得大象起舞再不跑就没有机会了,个人觉得大象起舞小盘股再不跑就没有机会了,股东,思源电气,0,same
551,真是垃圾,真是垃圾,None,华胜天成,0,same
4796,不会再开了,不会再开了,股东,抚顺特钢,0,same
880,孙子股,大盘风格转换，指数连续上涨3%，而这孙子下跌10%，太怂,None,辉煌科技,0,same
4587,万紫千红一点绿,这地方还真环保,None,一汽富维,0,different
3045,不等了，殺入山煤國際！！,不等了，殺入山煤國際！！,股东,乐凯胶片,0,same
4757,5.19全部出货。,5.19全部出货。,股东,铁龙物流,0,different
3408,抛盘放大 跑7.65不跑没机会了,抛盘放大 跑 7.65不跑没机会了,None,红阳能源,0,same
1051,88,只要大盘稍微下调几个点，它会跑的比兔子还快,None,百大集团,0,different
3482,验证：今天收盘9.19 明天下跌1.5个点,验证：今天收盘9.19 明天下跌1.5个点,None,精诚铜业,0,same
1244,很有节奏地一波波杀跌，有点恐怖，不解？,逆势下跌为哪般？,None,平高电气,0,different
2931,擦擦擦,小金属都涨停了，就这个王八蛋不行,None,华泽钴镍,0,different
1691,蓝筹大行情来了，别再玩小股票了,速度调仓到蓝筹股,股东,亚通股份,0,different
4626,36计-----------安全第一,一阴破3线,None,*ST天业,0,same
1230,不出真郁闷啊,随便换啊，都会比这垃圾好的多 ，出了出了,股东,维科精华,0,same
1920,大家以为这个垃圾能涨停吗，告诉你们不可能的，反正我已经全部清仓了，对这个垃圾不报希望了，告诉你们下午要大跌，赶紧跑吧,大家以为这个垃圾能涨停吗,股东,株冶集团,0,different
2598,到顶了！快跑！！！,到顶了！快跑！！！,None,招商银行,0,same
807,RT,"这开盘价,唉",None,神州信息,2,different
1961,他妈的庄家开始阳痿了，股价很难突破5元，还是没有被套的撤退为上,他妈的庄家开始阳痿了，股价很难突破5元，还是没有被套的撤退为上,股东,曙光股份,0,same
3100,726这垃圾比中成股份差远了!,726这垃圾比中成股份差远了!,None,华电能源,0,same
2359,从盘口看抛压坚决，略有反弹即有抛盘涌出，不太妙,抛压很重,None,平高电气,0,same
1538,宝钛养活着多少退休闲人你们知道不？宝钛的管理多么混乱你们知道不？,宝钛养活着多少退休闲人你们知道不？宝钛的管理多么混乱你们知道不？,None,宝钛股份,2,different
3304,,比大盘强一次就这么难吗     瞧你这点出息,None,风神股份,0,same
503,人气先起来你要怎么抛都很好跑,抛盘的你等人气凝聚了你在高位抛行不,股东,美尔雅,0,different
3944,金益已经增仓完毕，在中报出来之前力生只有拉升一件事情了,业绩下降是力生终于高送转的原因,股东,力生制药,1,different
4395,0,再见，阿斗000796,None,易食股份,0,same
4727,此股庄家已S，有空小散烧点纸钱！！感觉是这样的小散顶个！！！,此股后市的看法！,None,青海华鼎,0,different
1134,垃圾标准股份无庄，跟大盘小涨马上跌  标准已经遇到5块钱历史大阻力 很快就会跌 逃顶好机会,垃圾标准股份无庄，跟大盘小涨马上跌逃顶好机会,None,标准股份,0,same
